249,과자·스낵·쿠키,[사층빵집]부드러운쿠키7종,,5000,고급스러운 티 타임의 완성
249,과자·스낵·쿠키,[청우]고구마형과자190gx2번들,,1800,친숙해서 더 맛있는 스낵
249,과자·스낵·쿠키,[생미쉘]프렌치도넛초코마블450g,,12980,한 입에 쏙! 달콤한 도넛
249,과자·스낵·쿠키,[보닐라]감자칩275g,,19800,스페인에서 온 페인트통 감자칩
249,과자·스낵·쿠키,[엉클팝]동글이길쭉이보리과자2종,10,3582,깔끔한 맛과 가벼운 포만감
249,과자·스낵·쿠키,[오리온]고래밥160g,,2240,
249,과자·스낵·쿠키,[골든덕]솔티드에그피쉬&포테이토,,12500,싱가폴 여행 필수 아이템
249,과자·스낵·쿠키,[오리온]초코파이바나나맛12입,,3980,초코파이의 새로운 변신
249,과자·스낵·쿠키,[나폴레옹]미니쿠키6종선물세트,5,35150,다채로운 구성의 쿠키 세트
249,과자·스낵·쿠키,[롯데제과]몽쉘생크림케이크192g,25,2250,달콤한 초콜릿과 촉촉한 화이트 크림
249,과자·스낵·쿠키,[삼립]미니꿀약과10개입,,8500,넉넉하게 즐기는 한입 쏙 전통 간식
249,과자·스낵·쿠키,[마켓오]리얼치즈칩,,2000,두 가지 치즈가 진하게 녹아든
249,과자·스낵·쿠키,[수담수제]강정5종,20,1040,설탕 없이 만든 부드러운 강정
249,과자·스낵·쿠키,[롯데제과]카스타드오리지널252g,20,3520,부드러운 크림과 촉촉한 빵의 조화
249,과자·스낵·쿠키,[오리온]통크초코,,1000,고소한 통밀과 초콜릿의 만남
249,과자·스낵·쿠키,[호라푸드]시나몬츄러스,,3980,집에서 만나는 달큰한 츄러스
249,과자·스낵·쿠키,[발렌티나]바게트부르스케타2종,10,3150,파스타, 와인에 곁들이는 빵
249,과자·스낵·쿠키,[헌터즈]고메퀴노아칩3종,,4000,퀴노아를 즐기는 색다른 방법
249,과자·스낵·쿠키,[오리온]고소미216g,,2880,쏙쏙 꺼내 먹는 달달 고소함
249,과자·스낵·쿠키,초코범벅웨이퍼롤,,1400,초코 크림을 품은 바삭한 과자
249,과자·스낵·쿠키,[해태]홈런볼46g,30,1050,폭신한 슈 안을 꽉 채운 달콤함
249,과자·스낵·쿠키,[농심]옥수수깡70g,,1200,맛도 비주얼도 옥수수를 빼닮은
249,과자·스낵·쿠키,[우리밀]옥송이,,1500,입 안에서 사르르 녹는 과자
249,과자·스낵·쿠키,[농심]인디안밥83g,,1200,사르르 녹아내리는 고소함 가득
249,과자·스낵·쿠키,[리치]버터와플270g(15gx18입),5,3306,버터를 듬뿍 넣어 고소한 맛
249,과자·스낵·쿠키,[롯데제과]엄마손파이127g,,3000,384겹의 페스츄리 파이
249,과자·스낵·쿠키,[맥비티]투고다이제스티브2종,,2490,영국에서 온 담백한 비스킷! 다이제스티브의 원조!
249,과자·스낵·쿠키,[농심]감자깡75g,,1200,국산 찐 감자로 만든 바삭한 스낵
249,과자·스낵·쿠키,[액트투]전자렌지용팝콘(3개입),,3600,전자레인지로 돌려먹는 팝본
249,과자·스낵·쿠키,[아우어]토르테네켄웨이퍼2종,,1900,삼각형 모양의 오스트리아 전통 웨이퍼
249,과자·스낵·쿠키,[농심]오징어집83g,,1200,고소한 버터구이 향이 솔솔
249,과자·스낵·쿠키,[쿠키아]오리지널뚜부과자,,1800,국내산 두부로 만든 바삭한 스낵!
249,과자·스낵·쿠키,[롯데제과]칙촉오리지널90g,33,1600,촉촉한 쿠키에 큼직한 초코칩
249,과자·스낵·쿠키,[발로코]펙시네초코쿠키350g,,3980,기분이 좋아지는 달콤한 쿠키
249,과자·스낵·쿠키,[농심]알새우칩68g,,1200,담백하고 고소한 새우맛 과자
249,과자·스낵·쿠키,[농심]매운새우깡90g,,1000,새우깡의 매콤한 변신
249,과자·스낵·쿠키,[오리온]초코송이144g,,2240,한입에 쏙 들어가는 초콜릿 과자
249,과자·스낵·쿠키,[오리온]다이제초코225g,,2000,든든한 달콤함이 필요한 순간
249,과자·스낵·쿠키,[아티제]양과자쿠키세트,,23900,알차게 담아낸 풍미 좋은 쿠키
249,과자·스낵·쿠키,[롯데제과]쌀로별오리지널,,1500,자꾸만 손이 가는 고소한 스낵
249,과자·스낵·쿠키,[오레오]초콜릿을입은쿠키2종,,4980,초콜릿으로 무장한 바삭한 쿠키
249,과자·스낵·쿠키,[롯데제과]칸쵸단품54g,,1000,동글동글 귀여운 초콜릿 스낵
249,과자·스낵·쿠키,[농심]새우깡90g,,1000,자꾸만 손이 가는 스테디셀러
249,과자·스낵·쿠키,[파퍼스케틀콘]달콤사르르케틀콘2종,,2800,부드럽게 사르르 녹는 팝콘
249,과자·스낵·쿠키,[프롬잇]프로틴칩2종,,2100,구워도 바삭한 단백 칩
249,과자·스낵·쿠키,[청우]그랑쉘사과195g(10입),,2880,기분좋은 향긋함을 품은 쿠키
249,과자·스낵·쿠키,[플립츠]초콜릿프레첼4종,,3000,해외직구 인기상품! 이제 해외직구없이 편하게
249,과자·스낵·쿠키,[바릴라]부드러운이탈리아쿠키3종,,3980,담백한 비스킷 쿠키
249,과자·스낵·쿠키,[농심]새우깡400g,,3880,넉넉하게 즐기는 대용량 간식
249,과자·스낵·쿠키,쵸코바닐라크런치,,2680,곡물 크리스피롤 속 달콤함
249,과자·스낵·쿠키,[청우]참소라형과자190gx2번들,,1800,정감 있는 추억의 맛
249,과자·스낵·쿠키,[미주라]시리얼비스켓,,2000,4가지 곡물로 만든 고소한 스낵
249,과자·스낵·쿠키,[투바이트]브라우니스퀘어터브300g,,8300,넉넉하게 즐기는 진한 달콤함
249,과자·스낵·쿠키,[우리밀]제대로감자래요2종,21,1500,풍성한 감자의 맛과 향
249,과자·스낵·쿠키,[오리온]썬80g,,1200,짜릿하게 매콤달콤한 맛
249,과자·스낵·쿠키,[농심]벌집핏자90g,,1200,재미난 벌집 모양으로 즐기는 바삭함
249,과자·스낵·쿠키,[비첸지]미니스낵밀크1박스,,15800,밀크 크림의 부드러운 달콤함
249,과자·스낵·쿠키,[비첸지]쇼트브레드패스트리(틴케이스),25,11850,쿠키 4종이 들어간 센스있는 선물 !
249,과자·스낵·쿠키,[오리온]다이제초코볼,,3680,달콤함과 고소함을 한 입에 쏙
249,과자·스낵·쿠키,글로리베이커리쿠키스윗데이,5,25555,홍콩의 명물 버터 쿠키
249,과자·스낵·쿠키,[농심]조청유과96g,,1200,달콤한 조청으로 만든 우리 스낵
249,과자·스낵·쿠키,[bread&co]리얼브라우니쿠키2종,5,2755,함께 나누는 쫀득한 행복
249,과자·스낵·쿠키,[카라다]라이스볼오징어맛38g,,980,오징어 향을 입은 매콤 스낵
249,과자·스낵·쿠키,[롯데제과]치토스매콤달콤한맛,26,1100,감칠맛 가득한 스낵이 필요할 때
249,과자·스낵·쿠키,[로렌즈]크런치감자칩3종,40,1434,바삭한 식감이 제대로
249,과자·스낵·쿠키,[오레오]밀크스낵,50,850,부드러운 달콤함이 두 배
249,과자·스낵·쿠키,[농심]자갈치90g,,1200,한 입에 쏙 넣는 문어 모양 스낵
249,과자·스낵·쿠키,[고디바]프레스티지비스킷3종,,18000,초콜릿을 얹은 바삭한 비스킷
249,과자·스낵·쿠키,[청우]마렝고,15,2533,바삭한 식감을 배로 즐기는
249,과자·스낵·쿠키,무농약고구마로만든부드러운달구마,,2800,바로 꺼내 먹는 간편한 삶은 고구마
249,과자·스낵·쿠키,[던킨도너츠]레인보우링도넛2종,,5500,달콤한 코팅을 입힌 도넛
249,과자·스낵·쿠키,[알리멘트베지탈]유기농현미크래커씨솔트,,4900,
249,과자·스낵·쿠키,[청우]김맛나145g,,990,추억의 김 맛 스낵
249,과자·스낵·쿠키,[달프스머랭]크리스마스머랭쿠키2종,10,15750,달콤한 크리스마스를 위한
249,과자·스낵·쿠키,[롯데제과]빼빼로초코,10,1350,초콜릿 맛 막대과자의 원조
249,과자·스낵·쿠키,[맷죠프로젝트]맷죠칩3종,,4000,할머니가 구워주시던 과자의 재탄생
249,과자·스낵·쿠키,[알리멘트베지탈]유기농현미크래커허니,,7500,고소하면서도 달달하게
249,과자·스낵·쿠키,[고디바]프레스티지비스킷32p,,42000,
249,과자·스낵·쿠키,[오리온]꼬북칩초코츄러스맛80g,,1180,꼬북칩의 재미난 변주
249,과자·스낵·쿠키,[Quillo]오리지널,,7900,클래식한 매력의 프리미엄 감자칩
249,과자·스낵·쿠키,[닥터유]미니에너지바&단백질바2종,,4800,한 입에 쏙 들어가는 에너지
249,과자·스낵·쿠키,[롯데제과]빼빼로누드초코,10,1350,막대과자 속에 숨은 달콤함
249,과자·스낵·쿠키,[롯데제과]꼬깔콘군옥수수,34,990,구수한 군옥수수 맛
249,과자·스낵·쿠키,[SummerHarvest]스낵믹스팩,,6980,기내에서 즐기던 프레첼 스낵
249,과자·스낵·쿠키,[설탕없는과자공장]쑥무화과콩쿠키,,2900,쑥 향 가득 고소하고 쫀득한 쿠키
249,과자·스낵·쿠키,[디제이앤에이]머쉬룸크리스프2종,,3980,(호주 여행필수템) 버섯의 풍미를 가득 품은 스낵
249,과자·스낵·쿠키,[무화당]무화과브라우니쿠키,,2900,초콜릿 쿠키도 부담없이
249,과자·스낵·쿠키,[삼립]미담호빵,,9900,호빵의 정석
249,과자·스낵·쿠키,[오리온]꼬북칩콘스프맛80g,,1180,겹겹이 느껴지는 바삭함
249,과자·스낵·쿠키,[디제이앤에이]베지크리스프2종,10,5382,다채롭게 즐기는 건조 야채한팩
249,과자·스낵·쿠키,[호라푸드]곡물크리스피214종,,2800,21가지 국내산 곡물의 고소한맛
249,과자·스낵·쿠키,[아우어]밀크헤즐넛웨이퍼25gx5입,,3500,층마다 쌓아 올린 달콤함
249,과자·스낵·쿠키,[농심]양파링84g,,1200,손에 걸고 먹는 바삭 링 과자
249,과자·스낵·쿠키,[구욘]다이제스티브클래식2종,,2700,
249,과자·스낵·쿠키,[오레오]웨이퍼롤2종,,1300,가볍게 바스라지는 달콤한 막대 스낵
249,과자·스낵·쿠키,[마우나로아]소용량마카다미아스낵2종,,3000,하와이에서 날아온 견과류 스낵
249,과자·스낵·쿠키,[몰티저스]비스킷,5,5225,입 안에 가득 차는 달콤함
249,과자·스낵·쿠키,[농심]바나나킥75g,,1200,입에서 사르르 녹는 달달함
249,과자·스낵·쿠키,[오리온]참붕어빵,,4320,쫀득쫀득한 한 입 붕어빵
249,과자·스낵·쿠키,[미주라]비올라크래커,,4300,상큼 고소한 통밀 크래커
249,과자·스낵·쿠키,[오리온]무뚝뚝감자칩60g,,1200,두툼한 두께라 더 매력적
249,과자·스낵·쿠키,[비첸지]미니스낵헤이즐넛1박스,,15800,향긋한 헤이즐넛 크림이 가득
249,과자·스낵·쿠키,[더오담]한입땅콩강정,,2600,한입에 쏙 들어가는 땅콩강정
249,과자·스낵·쿠키,[해마루]파주장단콩팥소빵,,2000,구수한 맛이 한층 살아난
249,과자·스낵·쿠키,[청우]참깨스틱진220g,,2980,고소한 통참깨가 콕콕
249,과자·스낵·쿠키,[소이본]템페칩,,2300,템페가 들어간 바삭한 스낵!
249,과자·스낵·쿠키,[리치]오트밀미니바이트2종,7,1376,한 입에 쏙쏙 넣는 오트밀 스낵
249,과자·스낵·쿠키,[오리온]포카칩2종,,1180,생감자 그대로 담아낸 감자칩
249,과자·스낵·쿠키,[오리온]촉촉한초코칩320g,,3840,폭신해서 입에 착 감기는
249,과자·스낵·쿠키,[가데토스]오리지널스낵믹스10팩,20,7120,프레첼,호밀칩,브레드스틱 등 잡조름한 스낵
249,과자·스낵·쿠키,[발로코]포글리에티네200g,,2980,겹겹이 부서지는 달콤한 풍미
249,과자·스낵·쿠키,[페퍼리지팜]스트로베리쿠키,,4600,상큼한 딸기퓨레를 얹은 버터쿠키
249,과자·스낵·쿠키,[EXLAB]프로틴바이트2종,30,2940,한 입에 즐기는 단백질 스낵
249,과자·스낵·쿠키,[설빙]인절미스낵80g,,1900,국내산 쌀그릿츠를 사용한 고소하고 바삭한 인절미 스낵(80g/1봉)
249,과자·스낵·쿠키,[오리온]초코파이12입,,3840,초콜릿과 마쉬멜로우의 달콤한 만남
249,과자·스낵·쿠키,[크라운]쿠크다스화이트72g,20,1200,마스카포네 치즈의 부드러운 풍미
249,과자·스낵·쿠키,[Quillo]프라이드에그,25,5925,계란 후라이와 감자칩의 만남
249,과자·스낵·쿠키,[훼밀리]대국민옛날스낵2종,,1800,담백 고소한 국민 과자
249,과자·스낵·쿠키,[삼청동에그롤]부드러운에그롤4종,,6000,바삭바삭 부드럽게 녹아드는
249,과자·스낵·쿠키,[오리온]눈을감자56g,,1180,생감자를 튀겨 오독오독한 식감
249,과자·스낵·쿠키,[삼청동에그롤]부드러운에그롤3종,,20000,부드럽게 녹아드는 고소한 에그롤
249,과자·스낵·쿠키,[청우]오란다145g,,990,고소한 맛의 추억 속 과자
249,과자·스낵·쿠키,[삼청동소샌드]담백한소샌드2종,,23000,유기농 밀가루로 만든 샌드 쿠키
249,과자·스낵·쿠키,[조단스]뮤즐리바2종,,6900,양질의 재료를 아낌없이 넣은 뮤즐리 바
249,과자·스낵·쿠키,[커피빈]큐브모카웨하스,10,2700,달콤 쌉쌀한 미니 스낵
249,과자·스낵·쿠키,[농심]수미칩오리지널85g,,1910,오독오독한 국산 감자의 참맛
249,과자·스낵·쿠키,[생미쉘]마들렝250gX3봉,,11040,넉넉히 담은 촉촉! 폭신! 마들렝
249,과자·스낵·쿠키,[구욘]다이제스티브초콜릿씬,,3500,곡물과 초콜릿의 바삭한 만남
249,과자·스낵·쿠키,[라발란스]플러스고단백스낵6종,5,3325,단백질도 똑똑하게 챙겨주는
249,과자·스낵·쿠키,[우리밀]웨이퍼세트2종,,12000,기분좋은 바삭함
249,과자·스낵·쿠키,[알리멘트베지탈]유기농현미크래커애플,,6500,현미와 사과 주스의 완벽한 궁합
249,과자·스낵·쿠키,[피크닉]슈스트링포테이토오리지널2종,,3500,생감자로 만들어 바삭함이 일품
249,과자·스낵·쿠키,[롯데제과]치토스바비큐맛,,1500,화려한 맛을 뽐내는 치토스
249,과자·스낵·쿠키,[ChungChung]딸기초콜릿빨미까레,5,4275,바크초콜릿을 닮은 페이스트리
249,과자·스낵·쿠키,[청우]쫀득초코칩240g(12입),5,2641,초코칩이 콕콕 박혀 달콤한 맛
249,과자·스낵·쿠키,[밀카]초코스낵,,1700,폭신한 식감과 달콤한 맛
249,과자·스낵·쿠키,[김소영아티장의안단테]아티장비스킷Tea를위한쿠키4종,,7900,완벽한 티타임을 위한 티푸드
249,과자·스낵·쿠키,[오리온]배배80g,,1180,사르르 녹는 달콤 분유 과자
249,과자·스낵·쿠키,[롯데제과]몽쉘생크림카카오192g,,3000,부드럽게 퍼지는 달콤한 매력
249,과자·스낵·쿠키,[마켓오]다쿠아즈8입,,4000,촉촉하고 폭신한
249,과자·스낵·쿠키,[라아부엘라니에베스]스페인수제감자칩,,4900,손으로 정성껏 만들어낸 바삭한 감자칩!
249,과자·스낵·쿠키,[초코파이하우스]초코파이6종,5,2375,즐겁고 새로운 변신
249,과자·스낵·쿠키,[우리밀]제대로잘익은국산옥수수콘칩,20,1760,국내산 옥수수와 쌀로 건강하게 튀겨낸
249,과자·스낵·쿠키,[벨기에트레저]스페큘러스300g,,5900,벨기에 전통 과자로 즐기는 달콤한 여유
249,과자·스낵·쿠키,[댄케이크]버터쿠키틴케이스2종,,8000,버터가 함유된 고소한 풍미의 포르투칼 버라이어티 버터쿠키! (마가린 NO)
249,과자·스낵·쿠키,[옐로욜로]카카오칩,,3000,식단 관리 중에도 가볍게 즐기는 달콤쌉쌀한 간식!
249,과자·스낵·쿠키,[우리밀]우리밀계란과자,23,1680,좋은 재료로 완성한 포근한 맛
249,과자·스낵·쿠키,[가렛팝콘]프리미엄수제팝콘4종(백),10,5940,옵션이 추가된 간편한 프리미엄 가렛팝콘!
249,과자·스낵·쿠키,[내추럴초이스]과일건조칩5종,,2900,동결건조하여 바삭하고 상큼한 색다른 식감!
249,과자·스낵·쿠키,[근산식품]바삭은행,,990,고소한 은행의 바삭한 변신
249,과자·스낵·쿠키,[오!리얼]건강하게즐기는야채스낵5종,,2500,바삭바삭 즐거운 야채
249,과자·스낵·쿠키,[소산등로]대만파인애플케이크(펑리수),40,7200,(쇼핑백 포함) 대만의 대표 디저트 펑리수!
249,과자·스낵·쿠키,[모닝하우스]우리밀쿠키3종,,3750,무농약 우리밀로 구운 고소한 간식
249,과자·스낵·쿠키,[바비브레드]더가벼운라이스칩4종,,2500,가볍게 즐기는 바삭한 스낵
249,과자·스낵·쿠키,[바이오프로레]유기농퀴노아비스킷,,3300,과자로 즐기는 슈퍼푸드
249,과자·스낵·쿠키,[단풍고을]귀리새싹볼,,8000,우리 땅에서 기른 귀리로 만든 건강 간식
249,과자·스낵·쿠키,[파스키에]비스코티포켓,,4500,두 번 구워내 더 바삭하게, 더 고소하게
249,과자·스낵·쿠키,[유기농팝콘]솔티드&스위트,15,5015,프랑스에서 온 NON-GMO 팝콘!
249,과자·스낵·쿠키,[근산식품]튀긴호두,50,750,달콤함과 고소함의 조화
249,과자·스낵·쿠키,[브란트]러스크식빵패키지(10입),,8900,부담없는 선물로 제격
249,과자·스낵·쿠키,[팔와셔]웨이퍼크리스피브레드3종,,5800,미식의 재료로 변신한 크래커
249,과자·스낵·쿠키,[오희숙부각]캔찹쌀감자부각,10,17820,캔에 담아 즐기는 도톰한 감자 부각
249,과자·스낵·쿠키,[우리밀]참깨꼬소봉,20,2400,길쭉한 스틱 과자에 국산 참깨가 콕콕 박힌
249,과자·스낵·쿠키,[브란트]러스크미니2종,,3500,한 입에 넣기 좋은 독일 러스크
249,과자·스낵·쿠키,[MPOPCORN]판타지믹스(트러플플레이버),,4600,트러플과 버터의 환상 조합
249,과자·스낵·쿠키,[페퍼리지팜]초콜렛천크소살리토,,4900,밀크 초코칩과 마카다미아가 쏙쏙!
249,과자·스낵·쿠키,[MPOPCORN]러블리믹스(캐슈넛플레이버),,4200,부드럽게 빠져드는 매력
249,과자·스낵·쿠키,[MPOPCORN]로맨틱믹스(코코넛플레이버),,5000,달콤한 시간을 함께
249,과자·스낵·쿠키,[브란트]딜리셔스러스크,,4000,바삭바삭! 독일의 국민 간식
249,과자·스낵·쿠키,[불로동주유소]유기농슈퍼자미칩,,2600,설탕 없이 구운 담백한 곡물칩
249,과자·스낵·쿠키,[불로동주유소]유기농슈퍼홍미칩,,2600,열풍으로 구워낸 기능성 쌀
249,과자·스낵·쿠키,[캐기]스위스미니웨이퍼4종,,5500,얇은 과자와 진한 초콜릿 크림의 기분 좋은 달콤함
249,과자·스낵·쿠키,[타르투피지미]화이트트러플감자칩280g(대용량),,20000,화이트트러플 향이 풍부한 대용량(280g) 트러플칩
249,과자·스낵·쿠키,[프링글스]미니2종,,3480,한 입에 앙증맞은 감자칩
249,과자·스낵·쿠키,[알리멘트베지탈]유기농현미크래커퀴노아&씨위드,,4900,
249,과자·스낵·쿠키,[비첸지]밀레포글리에이탈리아패스트리(틴케이스),40,9480,4가지의 192겹의 바삭한 패스트리 과자를 한번에 !
249,과자·스낵·쿠키,[쿠키아]옥뚜카지,,1900,두부와 옥수수의 고소함 가득
249,과자·스낵·쿠키,[람베르츠]크리스마스틴500g,,22000,크리스마스 에디션 독일쿠키
249,과자·스낵·쿠키,[파르모니에]파르미지아노레지아노칩스,,5900,오븐에서 담백하게 구워낸 치즈 칩
249,과자·스낵·쿠키,[알룐카]웨이퍼딜라이트150g,,3500,간편하게 즐기는 고소한 초콜릿
249,과자·스낵·쿠키,[람베르츠]엑스퀴지트200g,,4500,가성비 좋은 10가지 쿠기를 담은 독일 쿠키
249,과자·스낵·쿠키,[삼립]전통밤만쥬(30개입),,6500,고소한 밤맛 가득 미니 사이즈 만쥬
249,과자·스낵·쿠키,[그라놀로지]선물세트2호,21,59250,풍성하게 담은 고소한 영양 간식
249,과자·스낵·쿠키,[삼립]허쉬초코호빵,,3600,허쉬 초콜릿과 손잡은 요즘 호빵
249,과자·스낵·쿠키,치즈범벅웨이퍼롤,,1400,달콤짭조름한 크림을 듬뿍
249,과자·스낵·쿠키,[피크닉]유기농포테이토스틱106g,,5900,깔금한 원재료가 증명하는 안심 스낵
249,과자·스낵·쿠키,[크라운]죠리퐁74g,20,1200,간식으로, 시리얼로 즐기는 스낵
249,과자·스낵·쿠키,[헌터즈]고메트러플감자칩25gx10개(박스),25,9000,한종지씩 즐기는 트러플 감자칩
249,과자·스낵·쿠키,[크라운]콘칲70g,20,1200,고소한 옥수수향이 가득
249,과자·스낵·쿠키,[스낵팜]다낭코코넛찹쌀크래커,,990,입안에 퍼지는 코코넛 풍미
249,과자·스낵·쿠키,[메종엠오]쿠키6종세트,,41900,
249,과자·스낵·쿠키,[메종엠오]쿠키3종세트,,20800,풍미 가득 고급스러운 쿠키 세트
249,과자·스낵·쿠키,[알리멘트베지탈]유기농현미크래커페어,,6900,새콤달콤 배 주스를 더한
249,과자·스낵·쿠키,[크라운]버터와플237g,40,3180,커피와 어울리는 풍미 가득 스낵
249,과자·스낵·쿠키,[CreateaTreat]유니콘&레인보우쿠키키트,,5980,알록달록 나만의 쿠키
249,과자·스낵·쿠키,[미주라]초코칩아마란스치아씨비스켓,,4100,오메가3를 함유한 초코칩 비스켓
249,과자·스낵·쿠키,[알룐카]웨이퍼스틱40g,,990,겹겹이 쌓인 부드러움
249,과자·스낵·쿠키,[밤뜨래]우리나라부여산맛밤,,2400,부드럽게 즐기는 본연의 단맛
249,초콜릿·젤리·캔디,[리터스포트]카카오셀렉션3종,20,2784,카카오에 따라 달라지는 매력!
249,초콜릿·젤리·캔디,[허쉬]후퍼스49g,,1200,바삭바삭 달콤한 한입 초코볼!
249,초콜릿·젤리·캔디,[칼만스]프로틴바5종,30,6930,식물성 단백질을 더한
249,초콜릿·젤리·캔디,[리터스포트]큐브초콜릿3종,30,5600,한 입 쏙 넣는 조각 초콜릿
249,초콜릿·젤리·캔디,[게메즈에낙]게메즈에낙라면스낵,,1100,맥주 안주로 잘 어울리는
249,초콜릿·젤리·캔디,[하리보]포켓사이즈젤리8종(100g),,1150,취향대로 골라 맛보는 젤리!
249,초콜릿·젤리·캔디,[야미얼스]유기농과일막대사탕2종,10,2700,새콤달콤한 과일 맛 막대사탕
249,초콜릿·젤리·캔디,[싱크]하이프로틴바5종,,3000,[1개당 단백질 20g 함유] 간편하게 챙겨먹는 미국 갬성 단백질바
249,초콜릿·젤리·캔디,[맛의고수]수제달고나곱빼기,,1750,바삭 달콤한 추억 속 달고나
249,초콜릿·젤리·캔디,[비바니]유기농초콜릿7종,,4300,유기농 식물성 원료로 더 깔끔하고 건강한 비바니 초콜릿
249,초콜릿·젤리·캔디,[세디타]넛티웨이퍼초코바3종,30,1260,출출한 오후에 꺼내는 간식
249,초콜릿·젤리·캔디,[데르뜨]떠먹는젤리3종(작은컵),,3300,진짜 과일을 품은 젤리
249,초콜릿·젤리·캔디,[프로틴방앗간]하루단백바흑임자(낱개박스),,2500,고소한 검은깨로 채우는 영양 단백질바
249,초콜릿·젤리·캔디,[드림카카오]다크초콜릿3종,,2160,부드럽게 녹아드는 한 알의 풍미
249,초콜릿·젤리·캔디,[젤리RO]티블렌드일곱가지곤약젤리,,9900,향긋한 차와 과일의 가벼운 만남
249,초콜릿·젤리·캔디,그래놀라바이트2종,,3600,일상을 채우는 고소함
249,초콜릿·젤리·캔디,[비빌]레몬비타캔디38g,,3000,비타민C, E, B2가 함유된 무설탕 레몬 캔디 (천연향료)
249,초콜릿·젤리·캔디,[앙팡드봉봉]한입에쏙!유기농한입솜사탕4종,,7500,사르르 녹는 달콤한 간식
249,초콜릿·젤리·캔디,[퍼지락]자일리톨캔디4종,,3700,처음 느껴보는 자일리톨 원석의 상쾌함
249,초콜릿·젤리·캔디,[몰티저스]몰티저스초코볼37g,5,1140,자꾸 생각나는 매력만점 간식
249,초콜릿·젤리·캔디,[그라쉐]아몬드바크씬,,2500,리얼 다크초콜릿과 미국산 아몬드가 듬뿍 들어간 조합!
249,초콜릿·젤리·캔디,[린트]린도르초콜릿4종,25,10500,72시간 마법이 만든 최상의 부드러움
249,초콜릿·젤리·캔디,[뷰티스위티즈]독일뷰티젤리4종,,1900,피부 미용에 도움을 주는 젤리!
249,초콜릿·젤리·캔디,[맛의고수]수제달고나홈카페토핑,,3790,달고나 라떼의 완성!
249,초콜릿·젤리·캔디,[떼르드글라스]유기농떼글이달고나,,1500,안심하고 즐기는 착한 간식
249,초콜릿·젤리·캔디,[리콜라]슈가프리스위스캔디4종,10,1548,허브추출물과 천연향료를 사용한 90년 전통 스위스 무설탕 캔디
249,초콜릿·젤리·캔디,[HEyDAy]생초콜렛2종,,11000,벨기에산 초콜릿으로 완성한 고급스러운 맛
249,초콜릿·젤리·캔디,[애니스]유기농버니푸룻젤리3종,25,4125,천연 과일 향료의 맛있는 유기농 젤리
249,초콜릿·젤리·캔디,[워커스]토피스3종,,1990,영국이 사랑하는 달콤한 간식
249,초콜릿·젤리·캔디,[쁘띠첼]워터젤리3종,,1400,6가지 재료로만 만든 안심 젤리
249,초콜릿·젤리·캔디,[Perledisole]포지타노캔디2종,,7900,포지타노에서 건너온 과일 캔디
249,초콜릿·젤리·캔디,[키토랩]스테비아초콜릿,,12000,가볍게 즐기는 달콤함
249,초콜릿·젤리·캔디,[프로틴방앗간]하루단백바치즈베리(낱개박스),,2500,또 다르게 즐기는 단백질바
249,초콜릿·젤리·캔디,[리터스포트]컬러풀버라이어티5종,20,2384,풍성하게 전해지는 초콜릿 풍미
249,초콜릿·젤리·캔디,[벨라민츠]후레쉬캔디2종,,1900,입안에 오래 남는 시원함
