914,우유·두유·요거트,[서울우유]국내최초저지밀크,,6900,저지 원유 100% 국내산 저지 우유
914,우유·두유·요거트,[파스퇴르]바른목장유산균우유,,3800,우리 아이를 위한 생유산균 우유
914,우유·두유·요거트,[서울우유]짜먹는요구르트짜요짜요3종,,1980,젤리가 들어 있는 스틱 요거트
914,우유·두유·요거트,[그릭데이]그릭요거트시그니처,,3000,꾸덕꾸덕한 질감의 농축 요거트
914,우유·두유·요거트,[요플레]플레인화이트430g,,2980,국산 원유의 순수함 그대로
914,우유·두유·요거트,[바른우유연구소]그릭요거트마일드2종,,3700,깔끔하게 달콤한 요거트 (가당)
914,우유·두유·요거트,[바른우유연구소]그릭요거트플레인2종,,3700,꾸덕한 질감의 담백한 요거트 (설탕 무첨가)
914,우유·두유·요거트,[연세우유x마켓컬리]전용목장우유,,1980,가격, 퀄리티 모두 만족스러운 1A등급 우유
914,우유·두유·요거트,[요플레]토핑요거트3종,,1300,요거트와 바삭한 토핑의 조화
914,우유·두유·요거트,[빙그레]뽀로로요구르트2종,,1490,칼슘과 자일리톨을 함유한 발효유
914,우유·두유·요거트,[요플레]오프룻마시는요거트3종,,1470,간편하게 마시는 마시는 요플레 요거트
914,우유·두유·요거트,[오틀리]식물성귀리음료5종,,2000,스웨덴에서 온 건강음료
914,우유·두유·요거트,[나투미]유기농귀리음료1L4종,10,6120,유기농 귀리의 고소함을 담은 나투미 귀리음료 1L 4종 (오리지날/바닐라/칼슘/초코)
914,우유·두유·요거트,[대학두유]대학약콩프로틴두유,,20600,식물성 단백질을 가득 담은
914,우유·두유·요거트,[매일]매일두유,,1590,달지 않고 고소한 콩 본연의 맛
914,우유·두유·요거트,[매일]매일두유1박스(12개입),,7560,두유로 만드는 편안한 하루
914,우유·두유·요거트,[매일]매일두유식이섬유1박스(12개입),,7560,달콤고소한 영양 간식
914,우유·두유·요거트,[매일]매일두유초콜릿1박스(12개입),,7560,두유와 생초콜릿의 만남
914,우유·두유·요거트,[매일]매일두유검은콩1박스(12개입),,7560,검은콩이 전하는 진한 고소함
914,우유·두유·요거트,[연세우유]전용목장멸균우유3종,,650,달콤해서 아이들이 더 좋아하는 우유
914,우유·두유·요거트,[연세우유]전용목장멸균우유(박스)3종,,9980,넉넉히 준비해두는 아이들 우유
914,우유·두유·요거트,[자연과사람들]아임밀크킹멸균우유2종,50,325,실온에서 보관하는 멸균 우유
914,우유·두유·요거트,[푸르밀]88바나나우유730ml,,2980,국산 원유를 88% 함유한 바나나 우유
914,우유·두유·요거트,[푸르밀]88생초콜릿우유730ml,,2980,진한 생초콜릿을 넣은 우유
914,우유·두유·요거트,[푸르밀]꿀이든미숫가루우유750ml,,2790,진하고 걸쭉한 미숫가루 우유
914,우유·두유·요거트,[푸르밀]검은콩이들어있는우유900ml,,1980,달콤하고도 담백고소한 맛
914,우유·두유·요거트,[맛있게한끼]국산콩콩물1000ml,,5700,넉넉히 즐기는 국내산 콩물
914,우유·두유·요거트,[맛있게한끼]국산콩콩물500ml,,3000,통쨰로 갈아낸 국내산 콩
914,우유·두유·요거트,[시기스]스키르아이슬란딕요거트7종,,4900,아이슬란딕 요거트의 원조!
914,우유·두유·요거트,[풀무원다논]식물성액티비아3종,,3980,식물성 원료로 만든 비건 요거트
914,우유·두유·요거트,[풀무원다논]아이러브요거트요거톡2종,,1300,요거트에 토핑을 톡톡
914,우유·두유·요거트,[상하목장]유기농요구르트플레인,18,2600,100% 유기농 우유와 유산균만으로 만든 자연 그대로의 플레인 요구르트
914,우유·두유·요거트,[상하목장]마시는유기농요구르트5개입,18,2000,텁텁하지 않고 깔끔한 뒷맛으로 더욱 맛있는
914,우유·두유·요거트,[Fage]파예플레이버요거트3종,,5400,무지방 그릭요거트와 달콤한 토핑이 만났어요
914,우유·두유·요거트,[폴스]휘핑크림250mL,,3700,호주산 방목 우유로 만든 신선한 크림! 조지방 함유량 35%
914,우유·두유·요거트,[파스퇴르]1A저지방우유,,650,어디서나 간편하게 마시는 프리미엄 저지방 우유
914,우유·두유·요거트,[총각네]팥두유,,14000,편하게 마시기 좋은 포근한 맛
914,우유·두유·요거트,[덴마크]스윗연유밀크티,,1500,간편함을 더한 부드러운 밀크티
914,우유·두유·요거트,[맑은물에]참좋은국산콩물,,5000,국산 콩을 곱게 갈아 만든 콩물
914,우유·두유·요거트,[맑은물에]참좋은국산흑임자콩물,,5500,콩물과 흑임자가 만나 고소함이 두배
914,우유·두유·요거트,[이레목장]유기농산양유2종,,2600,깨끗하게 섭취하는 산양유의 영양
914,우유·두유·요거트,[대상]마시는고단백뉴케어액티브2종,,2700,단백질과 영양소를 고루 담은
914,우유·두유·요거트,[잔다리마을]마시는콩물,,1800,생콩을 오롯이 담은
914,우유·두유·요거트,[덴마크]생크림,,5300,홈 디저트를 위한 준비물
914,우유·두유·요거트,[덴마크]요거밀3종,,4980,속이 든든한 요거트 한컵
914,우유·두유·요거트,[상하목장]유기농우유,17,3600,넉넉하게 만나는 유기농 우유
914,우유·두유·요거트,[상하목장]유기농우유저지방,20,3480,가볍게 만나는 유기농 우유의 고소함
914,우유·두유·요거트,[원더]휘핑크림라이트,,6100,풍부한 크림이 주는 진한 고소함
914,우유·두유·요거트,[서울우유]국산우유로만든연유,,4500,팥빙수와 프렌치 토스트에 뿌려먹는 국산연유
914,우유·두유·요거트,[그리다꿈]리얼생딸기라떼2종,,4900,톡톡 입안에서 터지는 국산 딸기
914,우유·두유·요거트,[그리다꿈]리얼바나나라떼2종,,4500,우유를 머금은 촉촉한 바나나
914,우유·두유·요거트,우리집건강한사과요거트750ml,,2750,아침을 깨우는 향긋한 요거트
914,우유·두유·요거트,우리집건강한딸기요거트750ml,,2750,새콤달콤한 1A등급 원유 요거트
914,우유·두유·요거트,우리집건강한망고요거트750ml,,2750,온 가족이 즐기는 달콤한 요거트
914,우유·두유·요거트,[요플레]ONLY3플레인요거트대용량1800ml,,7680,3가지 원료로 만든 깔끔한 요거트
914,우유·두유·요거트,[하늘빛]두(豆)구르트110ml,,2000,유산균을 함유한 유자향 발효유
914,우유·두유·요거트,[그릭데이]그릭요거트라이트,,3000,깔끔하게 즐기는 쫀득한 요거트
914,우유·두유·요거트,[임실치즈마을]프로바이오요거트더새콤블루베리,,1290,새콤달콤한 블루베리맛 요거트
914,우유·두유·요거트,[임실치즈마을]프로바이오요거트더달콤스트로베리,,1290,국내산 딸기를 함유한
914,우유·두유·요거트,[임실치즈마을]프로바이오요거트더진한플레인,,1290,언제든지 간편하게 즐기는
914,커피,[커피빈]헤이즐넛라떼파우치,,1500,커피빈 라떼를 어디서나 간편하게
914,커피,[커피빈]아메리카노파우치,,1300,언제 어디서나 간편하게 마시는
914,커피,[스타벅스]by네스프레소캡슐8종,,7700,집에서 내려 마시는 스타벅스 커피
914,커피,[매일]마이카페라떼6종,,1470,간편하고 맛있는 커피의 대명사
914,커피,[블루보틀]콜드브루커피2종,,6300,일상에 찾아온 블루보틀
914,커피,[스타벅스]디스커버리즈컵커피3종,,1940,스타벅스 레시피 그대로! 바쁜 일상을 달래줄 커피
914,커피,[스타벅스]by돌체구스토캡슐8종,,7900,스타벅스의 커피를 집에서 편안히
914,커피,[마이노멀]방탄커피,,2400,설탕 없이 든든하게 즐기는
914,커피,[헬카페]콜드브루,,13000,개성있는 블랜딩으로 완성한 짙은 여운 (500ml)
914,커피,[일리]커피캡슐21개입7종,,15900,'에티오피아' 추가 출시!
914,커피,[매일]바리스타컵커피5종,,1750,달콤한 커피가 주는 휴식이 필요할 때! 이젠 마켓컬리에서 만나보세요
914,커피,[나무사이로]드립백6종,,1000,일상을 빛내는 하이엔드 드립백
914,커피,[쟈뎅]시그니처파우치커피3종,,680,한 번 간단히 마시기 좋은
914,커피,[스타벅스]콜드브루2종,,2750,어디서든 즐기는 스타벅스 커피의 맛!
914,커피,[카페뎀셀브즈]콜드브루,,13200,한 모금에 담긴 고혹적 풍미
914,커피,[쟈뎅]시그니처보틀커피3종,,2900,합리적으로 만나는 대용량 커피
914,커피,[킴보]네스프레소호환캡슐4종,,5700,구수하고 진한 맛과 풍미를 자랑하는 킴보 캡슐로 간편하게 나폴리를 맛보세요 ( 시티즈 머신 호환불가)
914,커피,[폴바셋]바리스타캡슐3종,,7200,집에서 간편히 즐기는 폴바셋 커피
914,커피,[스타벅스]원두6종,,10900,스타벅스의 맛과 멋을 그대로
914,커피,[키토랩]방탄커피,,1800,든든하게 하루를 여는
914,커피,[언더프레셔]콜드브루커피2종,,15000,나를 위한 차가운 커피
914,커피,[카페뎀셀브즈]오리지널블렌드원두3종,,7200,향기로운 하루를 위한 커피
914,커피,[덴마크]콩카페라떼2종,,1300,간편하게 즐기는 베트남 정통 커피
914,커피,[매일]뉴플레이버바리스타컵커피5종,,2250,더 커진 용량으로 새롭게 돌아온 바리스타 컵 커피!
914,커피,[페이브]블랜디드원두4종,,8000,감미로운 로스팅 원두
914,커피,[프릳츠]콜드브루2종,10,8100,신중한 배합으로 완성한 개성
914,커피,[모모스커피]RTD콜드브루(에티오피아),,4500,산뜻하고 가벼운 커피 한 잔
914,커피,[모모스커피]RTD콜드브루(에스쇼콜라),,4500,깊은 단맛과 고소함이 담긴
914,커피,[헤베커피]RTD콜드브루2종,,3800,한 캔에 담긴 깊고 진한 풍미
914,커피,[컬리X언더프레셔]블랙&화이트콜드브루(디카페인),,6000,어느 때나 부담 없이 맛있게
914,커피,[마이노멀]시그니처방탄커피,,2700,더 진하게 즐기는 버터커피
914,커피,[블루보틀]블렌드원두4종,,25000,집에서 맛보는 감각적인 향미
914,커피,[모닌]카페시럽4종,,6300,홈카페에 진정한 품격을 더하는 프랑스 시럽
914,커피,[컬리X언더프레셔]블랙&화이트콜드브루(오리지널),,6000,정확한 비율로 완성하는 매일의 커피
914,커피,[다비도프]네스프레소호환캡슐커피3종,,4600,일상에 향기를 남기는 커피
914,커피,[마이노멀]버터모카,,2400,디카페인으로 즐기는 방탄 카페모카
914,커피,[센터커피]디카페인콜드브루,,15000,부담 없이 즐기는 향기로운 여유
914,커피,[SmallBatch]콜드브루(캔디맨),10,11700,일상 속 가볍게 더하는 원두 향
914,커피,[인텔리젠시아]콜드브루,,15000,한 잔만으로도 만족스러운 커피
914,커피,[빈브라더스]콜드브루2종,5,12350,진한 농도, 믿고 마시는 맛
914,커피,[덴마크]커핑로드3종,10,1350,골라 마시는 정통 블랜딩 커피
914,커피,[앤트러사이트]디카페인콜드브루,,15000,마음 편히 즐기는 뚜렷한 개성
914,커피,[커피빈]콜롬비아아메리카노2종,,6000,간단하고 여유로운 커피 타임
914,커피,[나무사이로]원두3종,,13000,일상을 빛내는 하이엔드 원두
914,커피,[SmallBatch]디카페인콜드브루,10,11700,고민 없이 누리는 한 잔
914,커피,[앤트러사이트]윌리엄블레이크콜드브루,,13000,지금 이 순간을 완성하는
914,커피,[루프트]콜드브루라떼,,6500,어디서나 즐기는 한잔의 여유
914,커피,[쟈뎅]에스프레소스틱4종,,1500,원두의 깊은 맛과 향
914,커피,[모모스커피]블렌드원두2종,,12000,깔끔한 맛, 깊은 여운
914,커피,[헬카페]디카페인콜드브루,,14000,카페인없이 즐기는 헬카페의 매력
914,커피,[인텔리젠시아]디카페인콜드브루,,15000,언제나 누구나 간편하게
914,커피,[누티카페]베트남인스턴트커피3종,,5400,여름에 시원하게 즐길 수 있는 맛있는 베트남 커피!
914,커피,크라스탄유기농오르조2종,,3900,커피인 듯 커피 아닌 차
914,커피,[마운트하겐]유기농디카페인커피2종(인스턴트),,11200,카페인 부담 없이 부드럽게 즐기는 커피
914,커피,[폴바셋]원두2종,,14000,집에서 맛보는 폴바셋의 깔끔한 커피
914,커피,[빈브라더스]디카페인콜드브루,5,13300,산뜻하고 부드러운 디카페인 커피
914,커피,[앤트러사이트]드립백샘플러(6개입),,9000,문학과 예술을 커피 한 잔에
914,커피,[LALA캡슐x502커피로스터스]네스프레소호환캡슐커피4종,,4300,편안하게 누리는 카페 시그니처 메뉴(5입/1팩)
914,커피,[커피리브레]드립백5종,,10000,[커피리브레x마켓컬리] 언제 어디서든 최상의 커피!
914,커피,[LALA캡슐x한국커피]네스프레소호환캡슐커피3종,,4300,편안하게 맛보는 각별한 풍미(5입/1팩)
914,커피,[나무사이로]와이칸콜드브루,,13900,밤 하늘의 별을 닮은 커피
914,커피,[언더프레셔]싱글오리진콜드브루2종,10,13500,차갑게 즐기는 싱글 원두의 매력
914,커피,[커피리브레]시그니처원두3종,,12000,전 세계 산지에서 품질 좋은 생두를 직접 수급
914,커피,[커피빈]캡틴아메리카노2종,,5800,손쉽게 스며드는 원두 향
914,커피,[루프트]드립백3종,,9800,가볍지만 깊은 스페셜티 원두의 풍미
914,커피,[나무사이로]디카프리오콜드브루,,15500,풍미 좋은 디카페인 콜드브루
914,커피,[인텔리젠시아]유기농콜드브루,,13900,유기농으로 즐기는 간편한 스페셜티
914,커피,[이퀄]아메리카노블랙2종,,1500,어디서나 편하게 즐기는 100% 아라비카 커피
914,커피,[커피리브레]더치커피1종,,15000,[커피리브레x마켓컬리] 언제 어디서든 최상의 커피!
914,커피,[센터커피]디카페인드립백(7개입),,11500,
914,커피,[모모스커피]드립백7개입3종,,11000,커피의 향기로 채우는 시간
914,커피,[센터커피]아이스브레이커콜드브루(컬리익스클루시브),,15000,색다른 기운을 불어넣는 한 모금
914,커피,[몰리나리]네스프레소호환캡슐커피6종,,6400,이탈리아 커피의 맛을 집에서도 쉽게
914,커피,[라오빈]콜드브루,,12000,스페셜티 전문 로스터리 원두의 깊은 풍미
914,커피,[오닉스커피랩]콜드브루,20,10320,전용 블렌딩으로 더욱 깔끔한 맛
914,커피,[언더프레셔]커피백3종,,9900,손쉽게 원두커피를 즐기는 방법
914,커피,[연경재]냉침커피트로픽가드너(TropicGardener),,4000,간단하게 즐기는 한 잔의 개성
914,커피,[나무사이로]스머프콜드브루,,13800,작은 원두 속에 숨은 풍부한 향미
914,커피,[센터커피]콜드브루게이샤,,12500,섬세한 풍미로 피어나는 신의 커피
914,커피,[커피빈]바닐라파우더,,24000,집에서 맛보는 카페 음료
914,커피,[센터커피]디카페인원두,,13000,부담 없이 즐기는 향긋한 한 잔
914,커피,[폴바셋]바리스타파우치드립백세트4종,,4800,직접 내려마시는 스페셜티 커피
914,커피,[모모스커피]에티오피아싱글오리진원두,,14000,깨끗하고 밝게 피어나는 산미
914,커피,[AKA]디카페인콜드브루,5,12350,카페인 없이 즐기는 시원한 한 잔
914,커피,[LALA캡슐x180커피로스터스]네스프레소호환캡슐커피(다크초콜릿블랜드),,4300,편안하게 맛보는 각별한 풍미(5입/1팩)
914,커피,[LALA캡슐x커피몽타주]네스프레소호환캡슐커피(비터스윗라이프1블랜드),,4300,편안하게 맛보는 각별한 풍미(5입/1팩)
914,커피,[센터커피]No7스페셜티커피드립백(7개입),,15000,매일 다른 커피를 만나는 일주일!
914,커피,[센터커피]아이스브레이커원두,,17000,섬세한 로스팅을 거친 스페셜티 커피
914,커피,[인텔리젠시아]유기농디카페인콜드브루,,16900,창조적인 시도로 완성한 귀한 커피
914,커피,[페이브]디카페인블렌드원두,,14000,오롯이 담긴 커피의 풍미
914,커피,[DukesCoffee]에스프레소블렌드원두2종,,17000,호주에서 로스팅한 감미로운 원두
914,커피,[모모스커피]디카페인드립백7개입(콜롬비아),,11000,밤에도 즐기는 간단한 커피
914,커피,[HACO]스위스인스턴트커피3종,,15200,90년 전통의 스위스 대표! 인스턴트 커피 브랜드
914,커피,[블루보틀]콜드브루보틀2종,,30000,근사하게 콜드브루를 만드는 방법
914,커피,[헬카페]드립백세트(7개입),,13000,짙고 묵직하게 피어오르는 여운
914,커피,[카페뎀셀브즈]커피백4종,,7500,일상 속 가볍게 더하는 원두 향기
914,커피,[LALA캡슐x커피맛을조금아는남자]네스프레소호환캡슐커피(케냐),,4300,집에서도 즐기는 홈카페(5입/1팩)
914,커피,[나무사이로]봄의제전콜드브루,5,16055,나무사이로의 시그니처 블렌딩
914,커피,[언더프레셔]드립백샘플러(8개입),,12000,세련된 패키지와 풍부하고 깊은 향
914,커피,[커피빈]소풍커피모카자바,,6900,언제 어디서나 나만의 핸드드립
914,커피,[루프트]콜드브루워터,,5900,산뜻한 산미와 부드러운 맛
914,커피,[LALA캡슐x이월로스터스]네스프레소호환캡슐커피2종,10,3870,편안하게 맛보는 각별한 풍미(5입/1팩)
914,커피,[FEAN]시그니처블렌드캡슐커피(15입),,9300,신선하게 내리는 커피 한잔
914,커피,[FEAN]콜롬비아메델린캡슐커피(15입),,9300,고소한 향미 가득 신선한 커피
914,커피,[연경재]701am드립백,,11000,아침을 깨우는 묵직함
914,커피,[LALA캡슐x퍼플레인]네스프레소호환캡슐커피2종,,4300,손쉽게 음미하는 원두의 풍미(5입/1팩)
914,커피,[딥블루레이크]스페셜드립백2종,,9000,망원동에 위치한 딥블루레이크! 철학이 담긴 드립백 2종
914,커피,[인텔리젠시아]블렌디드원두3종,,27200,스페셜티 커피에 날개를 달다
914,커피,[SmallBatch]디카페인드립백,,10000,진한 향기와 함께하는 밤
914,커피,[연꽃마을]우엉차(무농약우엉100%)50g,,8900,마실수록 끌리는 구수한 맛의 우엉차
914,커피,[인텔리젠시아]드립백3종,,9800,드립으로 내려 마시는 스페셜티 커피
914,커피,[인텔리젠시아]블랙캣아날로그콜드브루(패밀리팩),,27000,오래 즐기는 균형 잡힌 맛
914,커피,[FEAN]에티오피아캡슐커피(15입),,9300,부드럽게 느껴지는 풍부한 산미
914,커피,[다비도프]인스턴트커피컵세트4종세트,,15000,인스턴트 커피1개 + 다비도프 전용 컵 + 쇼핑백
914,커피,[아로마빌커피]핸드립스페셜티킬리만자로AAA2종,,9500,간편하게 즐기는 핸드립 스페셜티 커피!
914,커피,[AKA]드립백샘플러(4개입),,8000,매일매일이 홈카페
914,커피,[SmallBatch]드립백2종,,10000,간단하게 맛보는 멜버른 스페셜티 커피
914,커피,[AKA]블렌디드원두2종,,32000,캘리포니아에서 온 새로운 커피
914,커피,[AKA]OMG콜드브루,25,9750,코코아와 베리류의 완벽한 조화
914,커피,[인텔리젠시아]블랙캣에스프레소원두2종,,28500,블랙캣 프로젝트로 탄생한 커피
914,커피,[아로마빌커피]핸드립스페셜티에티오피아코체레케디다G12종,,9500,간편하게 즐기는 핸드립 스페셜티 커피!
914,커피,[아로마빌커피]핸드립스페셜티케냐캐리초AATOP2종,,9500,간편하게 즐기는 핸드립 스페셜티 커피!
914,커피,[인텔리젠시아]유기농블렌디드원두2종,,31500,스페셜티 커피의 새로운 가능성
914,커피,[연경재]NewNormal드립백,,11000,매일 마시는 커피의 새로운 기준
914,커피,[AKA]FTW콜드브루,,12500,어디서나 완벽한 커피 한 잔
914,커피,[DukesCoffee]커피백버라이어티팩(컬리에디션),10,17550,간편하게 즐기는 다양한 원두의 풍미
914,커피,[그레이그리스트밀]웨이크업블렌드원두200g,,20000,아침을 깨우는 향기
914,커피,[연경재]커피원두젤리빈(JellyBean),,25000,통통 튀는 산미와 개성
914,커피,[그레이그리스트밀]이지브루윙버라이어티팩(6개입),,14000,간단하지만 깊이 있는 커피
914,커피,[SmallBatch]멜버른스페셜티원두2종,,22000,커피 한 잔에 담긴 우아한 풍미
914,커피,[SmallBatch]디카페인원두,,22000,편안히 잠드는 향기로운 밤
914,커피,[연경재]JellyBean드립백,,15900,간단하지만 개성 넘치는 커피
914,커피,[AKA]로스터스초이스,,35000,시즌 따라 만나는 스페셜티 커피
914,커피,[크라스탄]오르조2종세트,,12500,커피 대신 마시기 좋은 이색 차
914,커피,[AKA]디카페인원두,,34000,잠 못 이루는 밤을 위한 한 잔
914,커피,[인텔리젠시아]버라이어티드립백(컬리에디션),,10800,하나씩 맛 보는 드립백 샘플러
914,커피,[인텔리젠시아]드립백세트,,31000,선물로 전하는 스페셜티 커피
914,커피,[카페뎀셀브즈]커피백4종세트,,31000,지금 이 순간을 향기롭게 물들이는
914,커피,[인텔리젠시아]드립백세트(컬리에디션),15,26350,드립백으로 음미하는 특별한 커피 한 잔
914,커피,[인텔리젠시아]오스쿠로콜드브루2종(300,500ml),,11900,진한 맛, 부드러운 여운
914,커피,[모모스커피]커피캡슐(에스쇼콜라)(네스프레소호환),,10000,캡슐로 즐기는 시그니처 블렌드
914,커피,[인텔리젠시아]겨울시즈널원두(보레알리스),10,31500,시즌 블렌드로 접하는 스페셜티 커피
914,커피,[네스카페]수프리모디카페인80개입,,10500,간편하게 즐기는 디카페인
914,커피,[커피빈]바닐라라떼12입,,7500,바닐라의 달콤 쌉싸름한 매력
914,커피,[헬카페]콜드브루200ml,,6000,개성 있는 블렌딩으로 완성한 짙은 여운
914,커피,[카페뎀셀브즈]시그니처원두1kg(엘클라시코),,31900,화사한 산미와 달콤함의 조화
914,커피,[Dukescoffee]커피백3종,,11000,new)과테말라 라스 메르세데스 신규 출시
914,커피,[페이브]하우스블렌드원두2종,,6900,섬세하게 완성한 로스팅 원두
914,커피,[미스터브라운]RTD캔커피3종,,990,간편하게 즐기는 대만 캔커피
914,커피,[FELT]블렌드드립백(디카페인),,11000,간편하게 내려 마시는 디카페인 커피
914,커피,[셀리니]에스프레소병100g,,12000,인스턴트로 즐기는 진한 에스프레소
914,커피,[페이브]드립백(블랙블렌드),15,5865,건강한 가치를 전하는 커피
914,커피,[나무사이로]커피캡슐(숲)(네스프레소용),,6900,울창한 숲처럼 풍부한 향미
914,커피,[페이브]디카페인드립백(콜롬비아),,7700,원두의 풍미를 오롯이 담아낸
914,커피,[네스카페]오리진스버라이어티팩,,10900,간편하게 떠나는 커피 여행
914,커피,[페이브]캡슐커피3종(네스프레소호환),,7200,캡슐로 만나는 스페셜티 커피
914,커피,[모모스커피하바나]파나마엘리다게이샤원두(20g),,7800,정성으로 영글은 하이엔드 원두
914,커피,[프릳츠]블렌딩원두(잘되어가시나),,16000,균형이 느껴지는 부드러운 맛
914,커피,[프릳츠]블렌딩원두(올드독),,16000,입 안 가득 풍성하고 묵직한 바디감
914,커피,[로우키]커피드립백6개입,,10000,차분한 매력을 담은 드립백
914,커피,[커피빈]더블샷라떼10입,,4800,더 깊게, 더 부드럽게
914,커피,[커피빈]카페라떼10입,,4300,원두와 우유가 자아내는 깊은 풍미
914,커피,[모모스커피하바나]파나마엘리다게이샤원두(100g),,38000,100g에 담은 게이샤 원두의 풍미
914,커피,[AKA]커피캡슐5종(돌체구스토용),5,12350,캡슐에 담긴 스페셜티 커피
914,커피,[Kurly's]에브리빈커피믹스2종,7,4092,원두 본연의 진한 맛을 담아
914,커피,[AKA]디카페인드립백,,13000,늦게 마셔도 좋은 감각적인 커피
914,커피,[페이브]캡슐커피디카페인(네스프레소호환),,8500,부담 없이 즐기는 한잔
914,커피,[닥터키친]다방커피,,10900,설탕을 넣지 않은 믹스커피
914,커피,[앤트러사이트]라이트블렌딩원두3종,,12000,향기를 전하는 감각적인 커피
914,커피,[나무사이로]디카페인드립백(디카프리오)(5개입),,7500,풍미 좋은 디카페인 커피
914,커피,[빈브라더스]토스트원두2종(컬리익스클루시브),,4900,균형감이 느껴지는 고소한 향미
914,커피,[콜린스그린]더콜드브루라떼x헬카페,15,3315,간편하게 맛보는 매혹 한 모금
914,커피,[EDIYA]비니스트오리지널아메리카노3종,,1850,부드럽게 넘어가는 진한 여운
914,커피,[커피빈]커피빈드립백디카페인,,5900,카페인 걱정없이 즐기는 한 잔
914,커피,[커피빈]커피빈드립백2종,,5900,간단하지만 깊은 커피 한 잔
914,커피,[인텔리젠시아]리브라리안스(디카페인),,27200,오롯이 보존한 원두의 맛과 향
914,커피,[AKA]커피캡슐디카페인(돌체구스토용),,13000,간단하고 부담 없는 커피 한 잔
914,커피,[EDIYA]비니스트바닐라라떼2종,,4000,집에서 즐기는 달콤한 바닐라향
