907,고구마·감자·당근,[KF365]햇감자1kg,,5990,믿고 먹을 수 있는 상품을 합리적인 가격에, KF365
907,고구마·감자·당근,한끼당근1개,,1300,딱 하나만 필요할 때 한끼 당근
907,고구마·감자·당근,친환경당근500g,,2990,껍질째 먹을 수 있는 친환경 흙당근 (500g 내외)
907,고구마·감자·당근,[KF365]밤고구마800g봉,,4590,포근하고 고소한 고구마(1봉/800g)
907,고구마·감자·당근,무농약햇감자600g,,4990,2020년 갓 수확한 무농약 햇 감자 (1봉/600g)
907,고구마·감자·당근,이유식재료친환경당근250g,,2200,남김 없이 즐기는 주홍빛 영양 당근(250g/1봉)
907,고구마·감자·당근,[네떼]베이비당근250g,,3600,아담한 사이즈에 하나씩 쓰기 좋은 앙증맞은 당근(1팩/250g)
907,고구마·감자·당근,무농약깐감자1개100g,,1400,간편하게 즐기는 포슬포슬 고소한 맛(1개/100g)
907,고구마·감자·당근,무농약손질한당근200g,,3300,원하는대로 썰어주기만 하면, 당근 준비 끝!(1봉/200g)
907,고구마·감자·당근,친환경우엉300g,,4980,땅속의 영양분을 듬뿍 머금고 있는 채소(1봉/300g)
907,고구마·감자·당근,[연꽃마을]친환경우엉채200g,,5750,깨끗하게 손질되어 바로 조려 먹는 친환경 우엉채 (200g)
907,고구마·감자·당근,깐마270g,,8490,손질 없이 맛보는 땅속의 영양 (1개/270g)
907,고구마·감자·당근,[달콘]초당옥수수(레토르트)1입,10,3141,간단히 데워 즐기는 달콤 옥수수
907,고구마·감자·당근,[KC]노랑옥수수2종,,2090,통째로 즐기는 달큰 부드러운 스위트콘!
907,고구마·감자·당근,유기농다진당근60g(냉동),,2200,은은한 단맛과 풍부한 비타민A
907,고구마·감자·당근,무농약조림용감자1kg,,3900,휴게소별미 버터구이 통감자를 집에서 (1봉/1kg)
907,고구마·감자·당근,마600g,,10900,영양 가득 알카리성 채소 마 600g
907,고구마·감자·당근,잘구웠군옥수수군250g,,1990,생각만 해도 고소하고 달콤한 군옥수수(1팩/250g)
907,고구마·감자·당근,[리더브랜드]베이비비트250g,7,5952,작지만 강력함으로 똘똘 뭉친 수퍼푸드 베이비 비트
907,고구마·감자·당근,[야채랑]냉동조각옥수수10입,,4400,스테이크 가니쉬로, 바비큐 구이로
907,고구마·감자·당근,유기농다진연근60g(냉동),,4200,아삭아삭 뿌리 채소의 영양
907,고구마·감자·당근,무농약연근2종,,6490,용도에 맞게 골라쓰는 무농약 연근(통연근 400g, 연근채 300g)
907,고구마·감자·당근,영암무농약꿀고구마2kg,,17500,포실포실 달콤한 꿀고구마를 무농약으로 즐기세요
907,고구마·감자·당근,해남꿀밤고구마15kg,,10900,황토에서 자란 달콤 해남 고구마
907,고구마·감자·당근,[KC]군옥수수더블콘,10,3420,불향을 입힌 달콤한 옥수수
907,고구마·감자·당근,흙당근1kg,,2990,영양 가득 당근을 더 신선하게 영양 가득 당근을 더 신선하게
907,고구마·감자·당근,[맛꾼푸드]아이스엿구마2종(냉동),,2660,간편하게 군고구마를 즐길 수 있는 냉동 고구마(2종)
907,고구마·감자·당근,친환경한입달수고구마700g,,4950,한입 사이즈로 간편하게 즐기는 달수 고구마 (1봉/700g)
907,고구마·감자·당근,나주영산포꿀밤고구마3kg,,18900,영산포 황토질 토양에서 키운
907,고구마·감자·당근,[KF365]호박고구마800g봉,,5890,더욱 촉촉하고 달콤한 호박고구마 (1봉/800g)
907,고구마·감자·당근,유기농다진당근100g,,2900,요리에 바로 더하는 주황빛 영양
907,고구마·감자·당근,더달콤한무농약숙성고구마15kg,,10500,숙성 과정에서 농축된 진한 달콤함
907,고구마·감자·당근,유기농달수고구마1봉800g,,6000,점점 달콤하고 쫀쫀해지는
907,고구마·감자·당근,제주흙당근1kg,,3290,제주도에서 자란 영양 가득 채소
907,고구마·감자·당근,깐감자1입150g,15,1691,요리에 바로 더하는 손질 감자
907,고구마·감자·당근,러셋감자2kg,,7990,미국에서 건너온 대왕 감자
907,고구마·감자·당근,영암친환경꿀고구마1kg,,8990,건강하게 즐기는 진한 달콤함
907,고구마·감자·당근,새싹채소씨앗10종,,1500,직접 길러 먹는 영양 가득 새싹
907,고구마·감자·당근,텃밭채소씨앗10종,,1000,직접 가꾸고 수확하는 텃밭 채소
907,고구마·감자·당근,우엉400g,,3990,영양과 식감이 좋은 채소, 우엉 400g
907,고구마·감자·당근,무농약세척당근500g,,3980,달달하니 맛있는 제주 당근을 편리 하게
907,고구마·감자·당근,무농약고구마로만든부드러운달구마,,2800,바로 꺼내 먹는 간편한 삶은 고구마
907,고구마·감자·당근,유기농달수고구마15kg,,12000,고구마의 달콤한 변신 햇고구마 (1박스 1.5kg)
907,고구마·감자·당근,[연꽃마을]유기농연근채300g,18,5480,아작아작하고 쫄깃한 식감, 씹을수록 우러나는 은근한 단맛
907,고구마·감자·당근,제주흙감자1kg,,5490,제주에서 온 활용도 만점 채소
907,고구마·감자·당근,나주영산포호박고구마3kg,,21900,황토가 빚어낸 노란빛 달콤함
907,고구마·감자·당근,해남호박고구마15kg,,11900,해풍이 기른 달콤 촉촉 고구마
907,시금치·쌈채소·나물,친환경시금치200g,,2100,뽀빠이가 좋아하는 바로 그 채소. 친환경 시금치 (200g)
907,시금치·쌈채소·나물,한끼깻잎20g,,1400,딱 깻잎이 조금 필요할 때 !
907,시금치·쌈채소·나물,GAP밀양깻잎3속,,1400,보랏빛이 일품인 밀양 깻잎
907,시금치·쌈채소·나물,한끼모둠쌈100g,,2490,부담 없이 즐기는 다양한 쌈 채소
907,시금치·쌈채소·나물,친환경잎채소쌈배추12통,,2500,고소함이 겹겹히 쌓인 미니배추
907,시금치·쌈채소·나물,추부깻잎30g,,1590,진항 향의 금산 추부 깻잎
907,시금치·쌈채소·나물,컷팅부추100g,,1980,먹기 쉽게 컷팅된 소용량 부추(1봉/100g)
907,시금치·쌈채소·나물,친환경잎채소깻잎30g,,1400,상큼하고 쌉쌀한 향기 (1봉/30g)
907,시금치·쌈채소·나물,한끼청상추50g,,1500,싱그러움이 느껴지는 초록빛 상추
907,시금치·쌈채소·나물,알배기배추1통,,2690,고소하고 달큼한 맛이 일품인 미니 알배기 배추 1통
907,시금치·쌈채소·나물,청상추150g,,2790,아삭아삭 싱그러운 잎채소, 청상추 150g
907,시금치·쌈채소·나물,한끼적상추50g,,1500,소용량으로 부담 없이 즐기는
907,시금치·쌈채소·나물,친환경쌈채소모둠200g,,3500,고기 없이 먹어도 맛있을 정도로 신선한 쌈채소 (200g)
907,시금치·쌈채소·나물,친환경잎채소로메인100g,,1800,아삭하고 부드러운 매력 (1봉/100g)
907,시금치·쌈채소·나물,상추&깻잎간편쌈120g,,2980,상추와 깻잎을 한번에!
907,시금치·쌈채소·나물,친환경잎채소청경채100g,,1600,중국 요리를 더욱 맛있게 (1봉/100g)
907,시금치·쌈채소·나물,부추200g,,2980,전으로 부쳐도, 무쳐먹어도 맛있는 만능 채소(200g/봉)
907,시금치·쌈채소·나물,적상추150g,,2690,삼겹살의 단짝 친구, 적상추 150g
907,시금치·쌈채소·나물,유기농베이비채소100g,,2600,부드럽고 떫은 맛이 나지 않는 싱싱한 어린 채소 (100g)
907,시금치·쌈채소·나물,구이용쌈모둠150g,,4200,상추,깻잎,고추,마늘 까지 간편 종합 모듬쌈(1팩)
907,시금치·쌈채소·나물,이유식재료친환경청경채50g,,1100,부드러운 맛의 이유식용 청경채(50g/1팩)
907,시금치·쌈채소·나물,친환경잎채소케일100g,,1800,싱싱, 깨끗, 건강한 케일(1봉/100g)
907,시금치·쌈채소·나물,한끼쌈케일40g,,1100,아삭하게 즐기는 소용량 채소
907,시금치·쌈채소·나물,미나리250g,,6000,탕거리의 단짝 친구, 향긋한 미나리(1봉/250g)
907,시금치·쌈채소·나물,친환경잎채소비타민100g,,1800,비타민을 듬뿍 품은 (1봉/100g)
907,시금치·쌈채소·나물,무농약유러피안쌈채소모둠200g,15,3825,식감이 부드러운 유럽종 쌈채소 모음(200g/1팩)
907,시금치·쌈채소·나물,친환경베이비시금치100g,,4000,작은 잎에 농축된 풍부한 영양 (1팩/100g)
907,시금치·쌈채소·나물,한끼시금치120g,,1680,딱 필요한 만큼만 담은 한끼 식사용 시금치
907,시금치·쌈채소·나물,친환경잎채소적상추100g,,1500,신선하게 즐기는 (1봉/100g)
907,시금치·쌈채소·나물,경기시금치250g단,,2450,두루 사용되는 국민 엽채류
907,시금치·쌈채소·나물,친환경잎채소청상추100g,,1200,싱그러운 초록빛을 머금은 (1봉/100g)
907,시금치·쌈채소·나물,이유식재료친환경비타민50g,,1250,귀여운 잎에 든 진녹빛 영양의 비타민(50g/1봉)
907,시금치·쌈채소·나물,영양부추100g,5,5975,씹는 맛이 살아있는 영양 부추
907,시금치·쌈채소·나물,친환경잎채소치커리100g,,1800,씁쓸한 맛의 매력 (1봉/100g)
907,시금치·쌈채소·나물,친환경아욱&근대2종,,2500,햇빛 담은 Green Table 아욱, 근대 (200g)
907,시금치·쌈채소·나물,친환경쑥갓150g,,1700,미각을 깨우는 향긋한 향! (150g)
907,시금치·쌈채소·나물,무농약고사리&도라지300g,,9900,
907,시금치·쌈채소·나물,친환경영양부추,8,3128,이름 그대로 영양 가득 싱싱한 영양부추(1봉/100g)
907,시금치·쌈채소·나물,참나물150g,5,3315,활용도 높은 향긋한 나물
907,시금치·쌈채소·나물,새싹모둠채소100g,,1650,생명력을 지닌 다채로운 새싹 채소
907,시금치·쌈채소·나물,이유식재료친환경아욱50g,,1250,영양 가득 부드러운 잎 채소(50g/1봉)
907,시금치·쌈채소·나물,친환경참나물150g,,2500,으뜸나물에 걸맞는 신선한 맛(150g/1봉)
907,시금치·쌈채소·나물,친환경삶은고사리와무시래기,,2800,친환경 삶은 나물 2종으로 간편하게 나물요리 준비 끝!
907,시금치·쌈채소·나물,베이비시금치,,3800,은은한 단맛 품은 어린 잎
907,시금치·쌈채소·나물,친환경잎채소적근대100g,,1800,예쁜 모양새만큼 맛도 일품 (1봉/100g)
907,시금치·쌈채소·나물,한끼쌈추40g,,1300,배추와 양배추의 장점만 살린
907,시금치·쌈채소·나물,한끼치커리60g,,1300,간편하게 사용하는 잎채소
907,시금치·쌈채소·나물,이유식재료친환경근대50g,,1250,초록빛 영양이 듬뿍한 근대(50g/1봉)
907,시금치·쌈채소·나물,공심채200g,,3500,우리 입맛에 딱 맞는 오리엔탈 채소 (1팩/200g)
907,시금치·쌈채소·나물,유기농신선초(즙용)300g,,1980,하늘이 내린 선물, 신선초 (300g 내외)
907,시금치·쌈채소·나물,무농약채도라지150g,,4900,귀찮은 도라지 손질은 이제 그만! (150g)
907,시금치·쌈채소·나물,한끼적치커리40g,,1300,쌉싸래한 향이 매력적인 컬러푸드
907,시금치·쌈채소·나물,한끼적근대40g,,1500,생으로 즐기기 좋은 붉은색 근대
907,시금치·쌈채소·나물,건나물7종,,5000,가지,호박,유채,토란,고구마,무말랭이,울릉도부지갱이
907,시금치·쌈채소·나물,[권영원소담정찬]건곤드레나물100g,,7000,한껏 피어오르는 향취
907,시금치·쌈채소·나물,한끼샐러리잎50g,,1500,쌉쌀하고 개운한 풍미
907,시금치·쌈채소·나물,깐도라지100g,,3290,깔끔하게 손질해 사용이 간편한
907,시금치·쌈채소·나물,친환경잎쌈배추120g,,1800,쌈 싸먹기 좋은 싱싱한 채소(1봉/120g)
907,시금치·쌈채소·나물,친환경무시래기100g,,3600,시래기의 천국, 양구에서 수확한 친환경 무 시래기 (100g)
907,시금치·쌈채소·나물,물냉이50g,,2850,톡 쏘는 알싸함 가득한 어린 잎
907,시금치·쌈채소·나물,고추냉이잎50g,,3700,이파리에 담긴 알싸한 맛
907,시금치·쌈채소·나물,고소한X나물밥상,,36800,참기름(40ml) + 들기름(100ml) + 삶은 시래기 캔나물 3캔 + 삶은 곤드레 캔나물 3캔
907,시금치·쌈채소·나물,씀바귀120g,,5490,입맛을 돋우는 쌉쌀한 매력 (1봉/100g)
907,시금치·쌈채소·나물,무농약쑥,,4600,바닷바람 속에서 더 깊어진 봄 향기(1봉/150g)
907,시금치·쌈채소·나물,한끼적겨자50g,,1300,알싸한 풍미의 적색 겨자잎
907,시금치·쌈채소·나물,아욱200g,,2890,연하고 부드러운 잎채소
907,시금치·쌈채소·나물,손질쌈배추200g,,1790,쌈으로 즐기는 달큼한 배춧잎
907,시금치·쌈채소·나물,나물용깻잎150g,,3490,보드라운 식감과 향긋함
907,시금치·쌈채소·나물,데친고사리200g,,5190,간편하게 만드는 나물 반찬
907,시금치·쌈채소·나물,근대200g,,2490,초록빛 영양이 듬뿍
907,시금치·쌈채소·나물,삼겹살용모둠쌈350g,,5990,한 팩이면 쌈채소 준비 끝
907,시금치·쌈채소·나물,친환경잎채소적겨자100g,,1500,톡 쏘는 매력 (1봉/100g)
907,시금치·쌈채소·나물,영덕시금치250g,,3990,영덕에서 온 제철 시금치
907,시금치·쌈채소·나물,달래60g,5,2840,봄을 알리는 똑 쏘는 향긋한 봄나물
907,시금치·쌈채소·나물,무농약청도한재미나리200g,,3490,미나리의 주산지, 청도의 아삭아삭 무농약 미나리
907,시금치·쌈채소·나물,한끼청겨자50g,,1500,활용도가 높은 알싸한 잎채소
907,시금치·쌈채소·나물,남해시금치250g,,3000,해풍을 맞으며 푸르게 자란
907,시금치·쌈채소·나물,청도미나리2종,,4600,생으로 먹고, 삼겹살과 구워도 먹는 미나리(300g, 500g)
907,시금치·쌈채소·나물,포항초250g,,3980,진하고 달큰한 포항 시금치 포항초 250g
907,시금치·쌈채소·나물,방풍나물150g,,3990,식탁에 봄내음을 더하는 채소 (1봉/150g)
907,시금치·쌈채소·나물,이유식재료친환경베이비시금치50g,,2200,연하고 부드러운 이유식 용 베이비 시금치(50g/1팩)
907,시금치·쌈채소·나물,세발나물150g,,1990,갯벌의 풍미를 머금은 나물 (1봉/150g)
907,시금치·쌈채소·나물,쑥갓200g,,2790,향긋하게 번지는 고소함
907,시금치·쌈채소·나물,청경채300g,,3590,아삭함과 부드러움을 동시에 지닌
907,시금치·쌈채소·나물,남해보물초시금치250g,,3600,단맛이 쏙쏙 배어있는
907,시금치·쌈채소·나물,한끼신선초30g,,1200,먹을 만큼 준비하는 간편 채소
907,시금치·쌈채소·나물,무농약부추200g,10,2421,외유내강, 영양 듬뿍 채소의 대명사 (200g)
907,시금치·쌈채소·나물,유기농미나리200g,7,3236,지하 120m 암반수로 자라 깨끗한 유기농 미나리 (1봉 200g)
907,시금치·쌈채소·나물,취나물150g,,2990,향긋함이 일품인 취나물
907,시금치·쌈채소·나물,당귀잎35g,,2300,향기가 남다른 건강 식재료
907,시금치·쌈채소·나물,곤달비100g,,3700,곰취를 빼닮은 향긋함
907,시금치·쌈채소·나물,냉이150g,,5300,향긋한 내음에 흠뻑 (1봉/150g)
907,시금치·쌈채소·나물,곰취80g,,2990,향긋 쌉싸래한 계절 산나물
907,시금치·쌈채소·나물,비금도재래섬초200g,,3880,단맛이 쏙쏙 배어 나오는 시금치
907,시금치·쌈채소·나물,유기농봄동300g,,3380,입맛 돋우는 봄의 전령사
907,시금치·쌈채소·나물,돌나물150g,,1790,풋풋하고 쌉싸름한 향기 (1봉/150g)
907,브로콜리·파프리카·양배추,무농약브로콜리2종,15,2286,송이송이 길러낸 속이 꽉 찬 무농약 브로콜리 (1송이 / 조각(팩))
907,브로콜리·파프리카·양배추,무농약조각양배추400g,,2900,건강하게 재배한 만능채소
907,브로콜리·파프리카·양배추,양배추2종,,1990,달큰 아삭 하게 즐기는 양배추
907,브로콜리·파프리카·양배추,한끼파프리카1입2종,,2190,필요한 만큼 쓰는 색색의 아삭함
907,브로콜리·파프리카·양배추,[KF365]국산브로콜리1입,,1400,믿고 먹을 수 있는 상품을 합리적인 가격에, KF365
907,브로콜리·파프리카·양배추,이유식재료친환경양배추14통,,1690,남길 걱정 없은 아삭달큰한 양배추(1/4통)
907,브로콜리·파프리카·양배추,절단셀러리500g,,2990,싱그러운 향의 아삭한 채소
907,브로콜리·파프리카·양배추,미니양배추(브뤼셀스프라우트)200g,,4490,작아진 양배추, 맛과 영양은 더 커졌어요 (200g)
907,브로콜리·파프리카·양배추,양상추1입,,2490,샐러드에 빠지지 않는 아삭한 양상추
907,브로콜리·파프리카·양배추,친환경비트2~4입,,4990,아름다움과 영양을 겸비한 퍼플푸드(1봉/800g 내외)
907,브로콜리·파프리카·양배추,이유식재료친환경브로콜리100g,,2290,간편한 이유식용 브로콜리(100g/1팩)
907,브로콜리·파프리카·양배추,[Dole]미니로메인하트220g,,5700,겉잎을 떼고, 연한 잎만 소포장한 미니로메인
907,브로콜리·파프리카·양배추,[Dole]로메인하트300g,5,5605,아삭한 식감이 전하는 청량함 (1봉/2~3입)
907,브로콜리·파프리카·양배추,이유식재료친환경적양배추14통,,1700,신선하게 담은 보랏빛 영양의 적채(1/4통)
907,브로콜리·파프리카·양배추,무농약파프리카1개,,3490,과일보다 더 과일같은 채소 파프리카 (1개)
907,브로콜리·파프리카·양배추,유기농브로콜리600g(냉동),,7500,필요한만큼 꺼내쓰는 편리한 유기농 브로콜리
907,브로콜리·파프리카·양배추,꼬깔양배추1통,,3490,외계인 같이 생겼지만 맛있는 양배추 600g
907,브로콜리·파프리카·양배추,무농약적채12개,,2800,과일만큼 아삭하고 달콤한 적채 1/2통
907,브로콜리·파프리카·양배추,유기농다진브로콜리60g(냉동),,2500,싱그러운 초록빛의 영양
907,브로콜리·파프리카·양배추,무농약버터헤드레터스1개,,3400,달콤하고 부드러운 이파리가 한통~ (1통)
907,브로콜리·파프리카·양배추,유기농다진비트60g(냉동),,3800,안토시아닌이 풍부한 붉은빛 영양
907,브로콜리·파프리카·양배추,유기농다진파프리카60g3종(냉동),,5300,화려한 색감, 풍부한 영양
907,브로콜리·파프리카·양배추,유기농다진적양배추60g(냉동),,3500,아이의 눈길 사로잡는 퍼플 푸드
907,브로콜리·파프리카·양배추,친환경콜라비1개,,2290,양배추와 순무의 장점을 지닌 보라빛 채소(1개/400g 내외)
907,브로콜리·파프리카·양배추,이탈리안치커리라디치오1개,,4800,눈으로 먼저 먹는 컬러풀한 특수 채소 (1통)
907,브로콜리·파프리카·양배추,친환경미니파프리카150g,,3500,과일 못지 않은 상큼함! 앙증맞은 사이즈 (150g)
907,브로콜리·파프리카·양배추,와사비줄기절임100g(냉동),,12500,얇고 잘게 다져 식감도 별미
907,브로콜리·파프리카·양배추,파프리카2입,,4290,요리의 색감을 위한 필수채소
907,브로콜리·파프리카·양배추,국산냉동콜리&브로믹스300g,,6500,음식의 색감과 식감을 살려주는 국산 컬리플라워
907,브로콜리·파프리카·양배추,[네떼]프릴라이즈180g,,2790,처음 맛보는 아삭아삭함
907,브로콜리·파프리카·양배추,제주콜라비1kg내외,,3700,국내 최초 10brix 비파괴 당도선별 콜라비
907,브로콜리·파프리카·양배추,무농약양상추1통,,2990,냉장고 필수채소, 매일 먹는 무농약 양상추 (1통)
907,브로콜리·파프리카·양배추,콜라비1개,,1790,익숙한 맛의 이색 채소, 콜라비
907,브로콜리·파프리카·양배추,콜리플라워1입,,4190,부드럽고 연한 비타민 가득 채소
907,브로콜리·파프리카·양배추,비트1kg,,3490,주스용으로 탁월한 영양 가득한 붉은빛 채소
907,브로콜리·파프리카·양배추,유기농다진적양배추100g,,3000,편리하게 꺼내 쓰는 보랏빛 채소
907,브로콜리·파프리카·양배추,통셀러리1봉,,2690,통째로 누리는 싱그러움
907,브로콜리·파프리카·양배추,컬리&브로믹스,,4490,색깔 고운 컬리플라워와 브로콜리
907,브로콜리·파프리카·양배추,무농약사보이양배추,,3900,프랑스에서 즐겨먹는 곰보양배추(1통)
907,브로콜리·파프리카·양배추,유기농다진브로콜리100g,,2900,비타민 가득한 이유식 필수 재료
907,브로콜리·파프리카·양배추,비트1입,,2690,영양 만점 컬러푸드
907,브로콜리·파프리카·양배추,브로콜리2입봉,,2890,탐스럽게 열린 영양만점 채소
907,브로콜리·파프리카·양배추,친환경조각콜리플라워180g,,3800,손질할 필요없이 간편하게 즐기는 영양 식재료
907,브로콜리·파프리카·양배추,유기농다진양배추100g,,2900,속이 편한 한 그릇 뚝딱 완성
907,브로콜리·파프리카·양배추,베이비브로콜리200g,,3390,꽃을 닮은 아름다운 맛을 지닌 베이비 브로콜리 200g
907,브로콜리·파프리카·양배추,파프리카4입봉,,7490,달달 아삭 맛있는 파프리카를 대용량으로
907,브로콜리·파프리카·양배추,양상추2입봉,,4490,속이 꽉찬 큼지막한 양상추
907,브로콜리·파프리카·양배추,비트2kg박스,,6990,붉은 속살에 깃든 다채로운 영양
907,브로콜리·파프리카·양배추,제주방울양배추200g,10,3141,
907,브로콜리·파프리카·양배추,무농약공심채200g,,4000,깨끗한 맛으로 즐기는 이국채소(1팩/200g)
907,브로콜리·파프리카·양배추,유기농다진아스파라거스60g(냉동),,7500,잘게 다진 파릇한 채소
907,양파·대파·마늘·배추,[KF365]깐마늘200g,,2000,믿고 먹을 수 있는 상품을 합리적인 가격에, KF365
907,양파·대파·마늘·배추,양파15kg,,5290,단단하고 아삭한 양파의 매력 (1망/1.5kg)
907,양파·대파·마늘·배추,깐대파500g,,7890,만능 양념채소
907,양파·대파·마늘·배추,한끼양파2입,,2690,소용량으로 냉장고를 가볍게
907,양파·대파·마늘·배추,[KF365]양파18kg,,5490,믿고 먹을 수 있는 상품을 합리적인 가격에, KF365
907,양파·대파·마늘·배추,무농약양파2종,,2690,단단하고 달콤한 친환경 양파 (1봉 / 350g, 1kg)
907,양파·대파·마늘·배추,무1통,,1390,시원한 무 한 통
907,양파·대파·마늘·배추,무농약조각무1조각,,1890,한국인의 밥상에 빠질 수 없는 시원하고 아삭한 무
907,양파·대파·마늘·배추,한끼깐마늘100g,,1400,소용량으로 부담없이 이용하는 한끼 깐마늘
907,양파·대파·마늘·배추,무농약손질한잎몸대파200g,,4790,가장 맛있는 잎몸 부분만 따로 손질한 대파(1봉/200g)
907,양파·대파·마늘·배추,한끼대파250g,,3790,필요한 만큼만 쏙 담은 한끼 대파
907,양파·대파·마늘·배추,무농약깐양파1개100g,,1250,신선하고 깔끔하게 쓰는 양파(1개/100g내외)
907,양파·대파·마늘·배추,조각무2조각,,1990,한 번에 사용하기 딱 좋은
907,양파·대파·마늘·배추,[KF365]흙대파1단,,7490,믿고 먹을 수 있는 상품을 합리적인 가격에, KF365
907,양파·대파·마늘·배추,[풀무원]다진마늘2종,,3200,간편하게 사용하는 다진마늘
907,양파·대파·마늘·배추,친환경실파200g,,2600,부드러운 식감과 은은한 향이 좋은 실파(200g/1봉)
907,양파·대파·마늘·배추,이유식재료친환경양파1개,,1800,아삭아삭 영양채소 양파(1개/1팩)
907,양파·대파·마늘·배추,[종가집]국산다진마늘150g,10,4410,향 깊은 국내산 햇마늘을 곱게 다진
907,양파·대파·마늘·배추,흙생강100g,,1590,손질하지 않은 신선한 알싸함, 흙생강 100g
907,양파·대파·마늘·배추,무농약저민마늘50g,,2600,편썰기로 요리에 간편하게 이용하는 저민마늘
907,양파·대파·마늘·배추,친환경얼갈이&열무2종,,1600,찬바람이 불 때 더 맛있는 채소 (1봉 300g)
907,양파·대파·마늘·배추,[하선정]다진마늘2종,,4700,요리의 맛을 한층 깊게 만드는 다진마늘! -소용량, 대용량-
907,양파·대파·마늘·배추,무농약꼭지제거한마늘200g,,5500,꼭지까지 제거해서 씻기만 하면 되는 마늘 (1봉/200g)
907,양파·대파·마늘·배추,동결건조간편대파30g,,3900,알싸한 대파의 맛과 향이 그대로(30g/1봉)
907,양파·대파·마늘·배추,동결건조다진생강20g,,3900,물만 부어 간편하게 사용하는 동결건조 다진 생강
907,양파·대파·마늘·배추,동결건조다진마늘40g,,5500,실온보관이 가능한 신개념 다진마늘(1봉/40g)
907,양파·대파·마늘·배추,건고추40g,,3690,요리에 풍미를 더해주는
907,양파·대파·마늘·배추,[오일러스]빛깔좋은실고추10g,,1500,
907,양파·대파·마늘·배추,친환경무1개,,2490,식탁 위의 만능 식재료
907,양파·대파·마늘·배추,[갈릭꼬]효소발효황제마늘2종,,52000,효소 발효한 흑마늘을 간편하게 소분한
907,양파·대파·마늘·배추,무농약깐생강50g,,3000,요리의 풍미를 더하는 간편 향신채(1봉/50g)
