911,밑반찬,[신사동백반]양배추유자피클,,3600,더 산뜻하게 즐기는 피클
911,밑반찬,[진가네반찬]땅콩조림,,2700,고소한 영양 반찬
911,밑반찬,[도리깨침]건두부&건채소볶음,,6500,일품 요리처럼 즐기는 채식 반찬
911,밑반찬,[신사동백반]무나물볶음,,2900,담백하고 구수한 무나물
911,밑반찬,[미자언니네]도라지오이생채,,5300,매콤새콤 감칠맛 나는 기본 반찬
911,밑반찬,[Everyday]우렁강된장,,6500,구수함이 몽글몽글
911,밑반찬,[신사동백반]곤드레나물볶음,,3700,곤드레 특유의 향미가 전해지는
911,밑반찬,[Everyday]무생채,,3500,아삭아삭 맛깔스러운 밥도둑 (100g당 가격 : 1750원)
911,밑반찬,[바비엔]코다리조림,,9900,알차게 꾸린 코다리 요리 키트
911,밑반찬,[미자언니네]꽈리고추찜,,3800,알싸하고 매콤한 감칠맛
911,밑반찬,[게방식당]계방장,,7000,밥과 잘 어울리는 달걀 장조림
911,밑반찬,[미자언니네]가지강정,,4300,가지의 화려한 변신
911,밑반찬,[미자언니네]우엉조림,,4300,아작아작한 식감이 입맛을 끌어올려주는 미자언니네 우엉조림
911,밑반찬,[정미경키친]명란장조림,,6000,먹어본 사람만 아는, 진정한 밥도둑 반찬
911,밑반찬,[탐나는밥상]김밥속재료,,14500,도전, 손쉽게 싸는 김밥
911,밑반찬,[진가네반찬]부지갱이나물볶음,,3900,국내산 부지갱이의 고소하고 짭잘한 감칠맛!
911,밑반찬,[도리깨침]더덕영양부추,,8900,향긋한 더덕이 정갈히 담긴 보양 반찬
911,밑반찬,[비비고]오징어채볶음,,3480,국내산 해찬들 고추장으로 촉촉하게 볶아낸
911,밑반찬,[진가네반찬]다시마쌈,,6500,바다 내음 가득한 별미
911,밑반찬,[미자언니네]미역줄기볶음,,3500,바다의 영양을 머금은 반찬
911,밑반찬,[정미경키친]견과류잔멸치볶음,,6000,국내산 은빛 잔멸치로 만들어 더욱 맛있어진
911,밑반찬,[일품식탁]초절임무300g,,2700,무농약 무에 담긴 산뜻한 맛
911,밑반찬,[정미경키친]오이지무침,,6500,고소하고 야무진 손맛의 정석
911,밑반찬,[신사동백반]강된장볶음,,4200,짜지 않고 구수한 강된장
911,밑반찬,[정미경키친]황태채무침,,6500,메인요리 부럽지 않은 고급 반찬
911,밑반찬,[비비고]견과류멸치볶음,,3480,집반찬! 통견과류와 고소한 멸치볶음
911,밑반찬,[소중한식사]꽈리멸치볶음,,5000,빠질수 없는 우리 집 밥반찬
911,밑반찬,[도리깨침]오이&소고기볶음,,5500,아삭아삭한 식감이 일품
911,밑반찬,[굴다리식품]명태회초무침2종(냉장),,4900,새콤달콤함이 감도는 별미 반찬
911,밑반찬,[미자언니네]무말랭이진미무침,,4500,무말랭이와 진미채의 색다른 만남
911,밑반찬,[미자언니네]한우장조림,,13800,특제 간장 양념으로 부드럽게 졸여낸 한우 장조림
911,밑반찬,[스마일찬]오징어채간장볶음,,3900,달콤하고 짭조름한 밑반찬
911,밑반찬,[미자언니네]통들깨멸치깻잎찜,,5500,감칠맛 나는 밥도둑
911,밑반찬,[신사동백반]오징어실채볶음,,4200,부드러운 식감과 은은한 단맛
911,밑반찬,[진가네반찬]계란장조림,,5900,속이 든든해지는 밥반찬
911,밑반찬,[진가네반찬]건새우볶음순한맛,,3500,반찬 투정 날려줄 우리 아이 밥반찬
911,밑반찬,[진가네반찬]오징어채양념볶음,,3500,매콤하고 쫄깃한 마른반찬의 대명사
911,밑반찬,[권영원향토음식]장아찌5종,,11000,강원도 정선의 재료로 장인이 담근 간장깻잎, 양념깻잎, 명이나물, 무청, 고추 장아찌
911,밑반찬,[진가네반찬]소고기청양고추볶음,,6300,칼칼한 매력으로 즐기는 별미 반찬
911,밑반찬,[비비고]무말랭이무침,,3480,오독오독한 식감이 살아있는 밑반찬
911,밑반찬,[미자언니네]오징어실채볶음,,4000,밥을 부르는 달콤 짭조름한 맛
911,밑반찬,[미자언니네]통들깨애호박볶음,,3800,통들깨 솔솔 뿌려 고소한 밥반찬
911,밑반찬,[탐나는밥상]들기름에볶음김치,,6500,향긋함 품은 묵은지 반찬
911,밑반찬,[도리깨침]왕멸치쪽파고추장무침,,4900,큼직한 멸치의 아삭 매콤한 변신
911,밑반찬,[들국화]무쌈,,3800,믿고 먹는 새콤 별미
911,밑반찬,[미자언니네]양념생깻잎,,6000,향긋하고 알싸한 밥도둑
911,밑반찬,[소중한식사]더덕무침,,6700,알싸함으로 입맛 살려주는
911,밑반찬,[스마일찬]멸치양념볶음,,3900,영양 가득 멸치의 매콤한 변신
911,밑반찬,[진가네반찬]쥐포양념볶음,10,3150,자꾸만 손이 가는 매콤달콤한 그 맛
911,밑반찬,[스마일찬]매콤한진미채간장볶음,,3900,진미채의 매콤짭짤한 변신
911,밑반찬,[도리깨침]오징어도라지무침,,8900,입맛이 살아나는 새콤한 맛
911,밑반찬,[everyday]매실장아찌고추장무침,,7400,유기농 매실로 깨끗하게 만든 반찬
911,밑반찬,[신사동백반]오복채,,2600,감칠맛 나는 꼬들함
911,밑반찬,[도리깨침]매운오징어볶음,,9900,매콤달콤한 양념이 쏙쏙
911,밑반찬,[진가네반찬]닭가슴살장조림,,4900,달콤짭조름하게 즐기는 일품 반찬!
911,밑반찬,[신사동백반]무청시래기나물볶음,,3700,된장을 넣어 더 고소한
911,밑반찬,[진가네반찬]건취나물볶음,,4800,풍미 좋은 국내산 건취나물의 향긋함!
911,밑반찬,[미자언니네]오이지무침,,4000,매콤달콤하고 꼬들꼬들한 맛
911,밑반찬,[정미경키친]쑥갓두부무침,,4600,고소한 내음이 번지는 건강 반찬
911,밑반찬,[진가네반찬]오징어채간장볶음,,3500,오징어채 간장볶음
911,밑반찬,[진가네반찬]청양고추멸치볶음,,5500,국물이 자작한 경상도식 고추 멸치 반찬
911,밑반찬,[소중한식사]메추리알조림,,5500,한 입에 쏙, 달착지근한 조림
911,밑반찬,[순창성가정식품]마늘쫑장아찌,,3900,고흥산 마늘쫑으로 맛을 낸 영양만점 장아찌
911,밑반찬,[테이스티도쿄]연근,다시마땅콩조림,,3500,친근하지만 어딘가 특별한
911,밑반찬,[미자언니네]굴소스어묵볶음,,4000,식탁 위 스테디셀러 반찬
911,밑반찬,[Everyday]모듬피클,,4000,산뜻한 밥상, 개운한 입맛
911,밑반찬,[풀무원]깻잎무쌈,,3600,깻잎과 무절임을 한 번에
911,밑반찬,[청산바다]해조류피클2종(냉장),10,8010,색다르게 즐기는 꼬들꼬들함
911,밑반찬,[미자언니네]가마솥고사리나물볶음(냉동),,5500,비법 양념으로 깊은 맛을 더한
911,밑반찬,[신사동백반]오징어무말랭이무침,,3200,오징어 젓갈과 무말랭이의 조화
911,밑반찬,[정미경키친]매콤어묵볶음,,4500,쫄깃하고 매콤한 필수 반찬
911,밑반찬,[스마일찬]멸치간장볶음,,3900,달콤짭조름하게 즐기는 멸치 반찬
911,밑반찬,[미자언니네]양념더덕구이(냉동),,11000,매콤하고 향긋하게 입맛 돋우는
911,밑반찬,[소중한식사]떡꼬치소스,,4900,입맛을 돋우는 달콤한 매력
911,밑반찬,[스마일찬]열무나물,,3400,시원한 열무의 구수한 변신
911,밑반찬,[탐나는밥상]참나물무침,,4500,마음까지 향긋하게 하는 참나물무침
911,밑반찬,[순창성가정식품]한식간장으로담근명이나물절임,10,14850,울릉도산 명이나물에 담은 전라도 손맛
911,밑반찬,[정미경키친]매콤진미채무침,,6200,
911,밑반찬,[미자언니네]매콤황태양념구이,,8800,매콤하고 고소한 밥반찬
911,밑반찬,[진가네반찬]깨순조림,,4200,자작하게 국물을 졸여낸 경상도식 깻잎 새순 조림!
911,밑반찬,[Everyday]볶음고추장,,6700,불맛 입은 고추장의 감칠맛
911,밑반찬,[진가네반찬]대왕오징어간장조림,5,4940,감칠맛과 식감을 모두 갖춘
911,밑반찬,[진가네반찬]깻잎장아찌,,3900,향긋하고 새콤달콤한 저장 반찬
911,밑반찬,[Everyday]건파래무침,,4000,아이부터 어른까지 모두 좋아하는 건파래무침 (100g당 가격 : 5000원)
911,밑반찬,[진가네반찬]쥐포간장볶음,,3500,담백하고 쫄깃해서 부담 없는 반찬
911,밑반찬,[신사동백반]토마토돼지고기찜,,9900,담백하고도 새콤한 이색 찜 요리
911,밑반찬,[신사동백반]고추장멸치볶음,,3700,자꾸 손이 가는 매콤 짭짤함
911,밑반찬,[미자언니네]고등어조림,,11800,레몬의 향긋함이 느껴지는 고등어 조림
911,밑반찬,[탐나는밥상]제육볶음,,6500,자작하게 볶아낸 매콤한 감칠맛
911,밑반찬,[미자언니네]시골두부조림,,4500,부드러운 두부와 깊은 양념의 조화
911,밑반찬,[순창성가정식품]양념깻잎장아찌,,3900,국내산 노지 깻잎으로 만든 깻잎장아찌
911,밑반찬,[진가네반찬]가지간장볶음,,6500,실패 없는 담백한 가지 반찬
911,밑반찬,[소중한식사]우엉채조림,,4300,아작아작, 비법 간장으로 조려낸
911,밑반찬,순살가자미가스,,17000,납작한 모양 속 부드러운 식감
911,밑반찬,[미자언니네]어묵조림,,3500,한번 맛보면 자꾸 손이가는 밥반찬
911,밑반찬,[진가네반찬]소고기고추장볶음,,4200,맨밥에도 잘 어울리는 매콤한 감칠맛
911,밑반찬,[진가네반찬]오이나물초무침,,5500,입맛을 돋우는 싱그러움
911,밑반찬,[미자언니네]가마솥취나물볶음(냉동),,4800,비법 양념에 달달 볶아 맛을 낸
911,밑반찬,[탐나는밥상]오이장아찌,,4500,상큼하고 가볍게 즐기는 오이장아찌
911,밑반찬,[정미경키친]닭가슴살장조림,,5000,부드러운 닭가슴살이라 더욱 매력적인 장조림
911,밑반찬,[스마일찬]오징어채양념볶음,,3900,고소한 오징어채에 스며든 매콤달콤함
911,밑반찬,[신사동백반]묵은지돼지고기두루치기,,9200,묵은지와 돼지고기의 매콤한 만남
911,밑반찬,[진가네반찬]멸치간장볶음,20,2800,마른반찬의 대명사
911,밑반찬,[더반찬]고추장소스진미채(135g),,5900,매콤달콤 쫄깃한 밑반찬
911,밑반찬,[씨클레버]고등어시래기조림,,16900,먹기 편안한 순살 고등어가 쏙
911,밑반찬,[권영원소담정찬]고추장아찌400g,,12000,간장소스가 어우러진 아삭 고추
911,밑반찬,[더반찬]쇠고기옛날간장조림(350g),,9400,달콤짭조름 인기 만점 반찬
911,밑반찬,[더반찬]호두멸치볶음(100g),,4300,칼슘 가득 국내산 멸치와 호두를 볶아 만든
911,밑반찬,[진가네반찬]더덕무침,3,8245,생 더덕의 향긋함을 그대로
911,밑반찬,[더반찬]감자채햄볶음(250g),,4200,고소하면서도 짭짤한 매일 먹어도 맛있는
911,밑반찬,[스타락교]락교,,1600,새콤하고 아삭아삭한 매력
911,밑반찬,[진가네반찬]어슷우엉조림,,4600,온 가족 입맛을 사로잡는 반찬
911,밑반찬,[신사동백반]취나물볶음,,4200,취나물의 향긋함을 담은
911,밑반찬,[Everyday]무말랭이무침,,6000,씹는맛 가득한 무말랭이 무침 (100g당 가격 : 3000원)
911,밑반찬,[씨클레버]코다리시래기조림,,15900,쫀득하고 칼칼한 메인 찬
911,밑반찬,[진가네반찬]닭가슴살겨자소스냉채,,7200,사라진 입맛을 되찾아줄 알싸한 풍미!
911,밑반찬,[진가네반찬]건새우볶음매운맛,,3500,
911,밑반찬,[진가네반찬]오이나물양념무침,,5500,매콤새콤한 감칠맛과 식감이 살아있는
911,밑반찬,[혼신마켓]양배추피클,,4900,아삭 아삭, 상큼한 맛이 일품인 일본식 반찬
911,밑반찬,[미자언니네]아삭이된장무침,,3800,아삭한 식감과 풋고추의 풋풋한 향
911,밑반찬,[더반찬]오이지무침(170g),,4900,새콤달콤 입맛 돋우는
911,밑반찬,[더반찬]메추리알간장조림(300g),,5300,탱글탱글 맛있는 기본 반찬
911,밑반찬,[스마일찬]목이버섯쇠고기볶음,,3900,색다른 재료와 반가운 맛
911,밑반찬,[탐나는밥상]꽈리고추찜,,4500,개운한 매콤함
911,밑반찬,[미자언니네]애호박나물볶음,,4800,달큰하고 고소하게 입맛 달래는
911,밑반찬,[더반찬]고추장멸치볶음(90g),,4800,매콤달콤 우리 집 필수 반찬
911,밑반찬,[탐나는밥상]깻잎장,,5000,깻잎의 향긋함이 살아있는 깻잎장
911,밑반찬,[권영원소담정찬]간장깻잎장아찌300g,,12000,깻잎 고유의 향미를 간직한
911,밑반찬,[미자언니네]미니꽃게강정,,5500,껍질까지 통째로 먹을 수 있는 미니꽃게강정
911,밑반찬,[신사동백반]돼지고기묵은지찜,,9800,자꾸만 생각나는 매콤짭짤한 그 맛
911,밑반찬,[스마일찬]오이무겨자생채,,3200,겨자를 더해 알싸하게 먹는 생채
911,밑반찬,[진가네반찬]우엉메추리알장조림,,5500,아삭함과 담백함의 완벽한 조화!
911,밑반찬,[미자언니네]날치알깻잎달걀말이,,4800,톡톡 터지는 짭조름한 맛
911,밑반찬,[권영원소담정찬]양념깻잎장아찌300g,,13000,매콤한 양념이 고루 밴
911,밑반찬,[Everyday]고사리나물,,4000,정답게 나누기 좋은 나물
911,밑반찬,[빚고담고]부추장아찌,10,4500,알싸하고 부드러운 밑반찬
911,밑반찬,[스마일찬]동초나물,,3600,달큰한 겨울 나물
911,밑반찬,[미자언니네]강된장,,6800,짜지 않고 달큼한 강된장
911,밑반찬,[바른정찬]명이나물절임(매운맛),,6200,청양소스로 매콤하게 즐기는
911,밑반찬,[미자언니네]삼치간장조림,,7000,달콤 짭조름한 소스와 부드러운 삼치의 조화
911,밑반찬,[순창성가정식품]매실장아찌,,6000,순창산 매실로 담은 달콤한 매실 장아찌
911,밑반찬,[더반찬]고소해무나물(300g),,3300,고소하게 무쳐낸 무 나물
911,밑반찬,[Everyday]호박고지나물,,3500,자연의 영양을 달큼하게 무쳐낸 나물
911,밑반찬,[Everyday]시래기나물,,4000,소박하지만 건강한 별미
911,밑반찬,[권영원소담정찬]고추장더덕300g,,18000,매콤한 양념에 숙성된 더덕 반찬
911,밑반찬,[미자언니네]가마솥도라지볶음(냉동),,6500,야들야들하게 씹히는 나물
911,밑반찬,[everyday]꼬막양념무침,10,6030,개운하게 입맛 살리는 꼬막무침
911,밑반찬,[도리깨침]깍두기멸치된장지짐,,5000,뭉근하고 아삭한 이색 밥도둑
911,밑반찬,[한국맥꾸룸]맥조선간장명이나물장아찌250g,,12800,맑은 장으로 담근 울릉도 명이
911,밑반찬,[하나원]순매실,,26000,아삭하고 상큼하게 입맛 돋우는
911,밑반찬,[스마일찬]새송이닭가슴살조림,,3900,든든한 영양만점 반찬
911,밑반찬,[하나원]순마늘,,16500,매실청에 담가 부드럽고 향긋한 (300g)
911,밑반찬,[권영원소담정찬]명이나물장아찌300g,,17000,청량한 마늘 향이 폴폴
911,밑반찬,[순창성가정식품]울외장아찌,,4200,새콤달콤한 맛이 계속 생각나는 울외장아찌
911,밑반찬,[하나원]울외장아찌,,17000,오도독 즐기는 새콤 달콤 귀한 찬
911,밑반찬,[빚고담고]고수장아찌,30,5110,고수 본연의 풍미를 고스란히
911,밑반찬,[빚고담고]셀러리장아찌,10,5670,서양 채소로 만든 이색적인 저장 반찬
911,밑반찬,[하나원]오이피클무침,,17000,아삭하고 산뜻해지는 밥상
911,밑반찬,[하나원]모듬피클,,15500,10가지 채소를 상큼하게 즐기는
911,밑반찬,[하나원]참매실,,27000,특제 고추장으로 촉촉하게 버무린
911,밑반찬,와사비줄기절임100g(냉동),,12500,얇고 잘게 다져 식감도 별미
911,밑반찬,[빚고담고]무쭈글이장아찌,10,4860,꼬들꼬들한 식감으로 즐기는
911,밑반찬,[everyday]매운갑오징어볶음,,13000,식감으로 먼저 즐기는 매콤 별미
911,밑반찬,[버섯마루]송고피클,,12000,송고버섯으로 담은 상큼 피클
911,밑반찬,[순창성가정식품]고들빼기장아찌,,4500,특제 양념에 버무린 여수 고들빼기
911,밑반찬,[하나원]매실더덕,,29000,향긋한 과일향이 덧입혀진
911,밑반찬,[마츠쿠라]이부리갓코,,15900,오독오독 씹는 묘미, 일본식 훈연 절임
911,밑반찬,[도리깨침]오독오독줄기상추무침,,4900,매력적인 식감의 특색있는 반찬
911,밑반찬,[하나원]모듬장아찌,,18000,계절채소를 매콤달콤하게 즐기는 (300g)
911,밑반찬,[권영원소담정찬]무청장아찌600g,,11000,무와 무청이 어우러진 장아찌
911,밑반찬,[버섯마루]목이피클,,10000,목이버섯의 새콤한 변신
911,밑반찬,[하나원]참마늘,,18000,향긋한 매실고추장으로 버무려낸 (300g)
911,밑반찬,[하나원]명이나물,,36000,고기의 단짝, 알싸하게 입맛 당기는 (300g)
911,밑반찬,[키슈난코바이]벌꿀우메보시,,39000,문득 생각나는 일본 스타일 매실 장아찌
911,밑반찬,[하나원]파장아찌,,14500,싱싱한 쪽파와 건오징어채의 색다른 만남 (250g)
911,밑반찬,[하나원]우엉피클,,17000,특제 간장과 새콤하게 어우러지는
911,밑반찬,[Everyday]황태간장양념구이(냉동),10,9000,간장양념으로 감칠맛을 살린 황태구이
911,밑반찬,[신사동백반]구수한알타리지짐,,9200,입맛 돋우는 정겨운 반찬
911,밑반찬,[진가네반찬]깐멸치볶음,,3500,씹는 맛이 좋아 더 고소한 밑반찬
911,밑반찬,[진실된손맛]모둠나물진실3종(고사리&도라지&취나물),,7200,향긋하고도 고소한 풍미
911,밑반찬,[진실된손맛]모둠나물손맛3종(시금치&콩나물&느타리),,4900,깔끔하게 버무린 세 가지 나물
911,밑반찬,[게방식당]미나리장,,4500,기분좋은 식감이 매력적인
911,밑반찬,[신사동백반]통영식오징어어묵무침,,7200,충무김밥의 영원한 단짝
911,밑반찬,[신사동백반]마늘종오징어조림,,5200,쫄깃함과 아삭함을 한 번에
911,밑반찬,[올음]모둠피클,,3200,세가지 경쾌함을 담은 피클
911,밑반찬,[진가네반찬]어묵잡채,,4900,어묵의 색다른 변신
911,밑반찬,[신사동백반]호박씨아몬드지리멸치볶음,,3900,견과류와 멸치의 고소한 만남
911,밑반찬,[씨뜰리에]명이나물장아찌150g,,6900,강원도 명이나물로 정갈하게 담근
911,밑반찬,[미자언니네]돼지고기안심메추리알장조림,,7000,국산 맛간장으로 조려낸 장조림
911,밑반찬,[올음]치킨무,,990,빠지면 섭한 시원 새콤한 맛
911,밑반찬,[신사동백반]백목이버섯냉채,,4900,기름진 음식에 곁들이는 산뜻한 반찬
911,밑반찬,[진가네반찬]얼갈이배추된장조림,,4800,깊이 스며든 구수한 맛
911,밑반찬,[빚고담고]봄나물장아찌(죽순),20,7040,은은하게 풍기는 향취
911,밑반찬,[신사동백반]제육감자조림,,6800,든든하게 완성한 감자조림
911,밑반찬,[Kurly's]동물복지비빔반숙계란장순한맛,,5900,고소하게 즐기는
911,밑반찬,[미자언니네]매콤마늘쫑진미채무침,,4900,입맛 살리는 매콤달콤 반찬
911,밑반찬,[씨뜰리에]햇더덕장아찌,,6900,햇더덕의 향긋함을 품은 장아찌
911,밑반찬,[씨뜰리에]곤드레장아찌150g,30,4830,줄기는 아삭, 잎사귀는 꼬들
911,밑반찬,[둥구나무자연그대로]유채나물,,4300,어디든 어울리는 깔끔한 밑반찬
911,밑반찬,[씨뜰리에]곰취나물장아찌150g,,6900,고성의 해양심층수로 담근
911,밑반찬,[신사동백반]새꼬막양념무침,,8900,고소함을 더한 꼬막무침
911,밑반찬,[진가네반찬]피망잡채,,4900,완벽한 궁합이 돋보이는
911,밑반찬,[신사동백반]알새우들깨토란대볶음,,6900,들깨의 고소함을 입은 토란 줄기
911,밑반찬,[올음]무쌈,,1980,국산 무에 깃든 산뜻함
911,밑반찬,[진가네반찬]깨순나물된장무침,,4900,향긋한 깨순의 구수한 변신
911,밑반찬,[Everyday]양념더덕,,12000,손쉽게 만드는 영양 반찬
911,밑반찬,[둥구나무자연그대로]연근유자피클,,9100,상큼하고 시원한 맛
911,밑반찬,[진가네반찬]호박새우젓볶음,,5100,감칠맛이 살아 있는 기본 밑반찬
911,밑반찬,[진가네반찬]느타리버섯양념볶음,,4300,매콤하게 즐기는 이색 밑반찬
911,밑반찬,[더반찬]새우젓호박볶음(250g),,5500,부드럽고 구수한 별미 반찬
911,밑반찬,[진가네반찬]꼬시래기초무침,,4500,색다른 매력의 해조류 반찬
911,밑반찬,[Kurly's]동물복지비빔반숙계란장매운맛,,5900,어른 입맛에 맞춘 매콤한 비빔 계란장
911,밑반찬,[미자언니네의봄]미나리듬뿍계란말이,,4600,봄의 향기를 품은 계란말이
911,밑반찬,[SEN]칠리페퍼피클,,2990,새콤함이 더해진 화끈한 매운맛
911,밑반찬,[둥구나무자연그대로]컬러방울토마토피클,,9300,곁들이기 좋은 상큼한 반찬
911,밑반찬,[신사동백반]들깨느타리무나물,,3900,층층이 고소함을 얹은 무나물
911,밑반찬,[올음]오이지,,3900,다양하게 잘라 먹는 통 오이지
911,밑반찬,[정미경키친]양파&청양고추장아찌,,3800,깔끔하게 입맛 돋우는 매콤함
911,밑반찬,[진가네반찬]숙주햄볶음,,4500,온 가족이 좋아하는 짭짤한 반찬
911,밑반찬,[신사동백반]아삭한배추김무침,,4700,싱그러움을 담은 배추무침
911,밑반찬,[두부씨의건강한끼]해초&포두부쌈,3,7275,바다와 땅의 건강한 만남
911,밑반찬,[더반찬]광주별미소고기육전,,10900,육전과 파무침의 완벽한 조합
911,밑반찬,[누리웰]10g단백계란찜,,2500,한 컵으로 즐기는 단백 가득 하얀 계란찜
911,밑반찬,[진가네반찬]가지볶음,,4900,쫄깃하게 씹히는 가지 요리
911,밑반찬,[진가네반찬]느타리버섯간장볶음,,4300,입맛을 돋우는 쫄깃한 매력
911,밑반찬,[신사동백반]홍합과버섯을올린칼칼한무조림,,6200,무조림에 가미된 쫄깃한 식감
911,밑반찬,[씨뜰리에]오가피순장아찌150g,,6900,깨끗한 고성의 해양심층수로 담근
911,밑반찬,[진가네반찬]간장돼지불고기,,4500,자꾸만 손이 가는 짭조름한 감칠맛
911,밑반찬,[진가네반찬]호박소고기나물볶음,,5100,달큰 짭조름한 매일 반찬
911,밑반찬,[진가네반찬]두부강된장,,5200,구수함이 남다른 밥도둑 반찬
911,밑반찬,[신사동백반]곤약뿌리채소조림,,5500,아삭한 한 입으로 전해지는 땅의 힘
911,밑반찬,[둥구나무자연그대로]꼴뚜기견과조림,,4900,매콤하게 즐기는 조림 반찬
911,밑반찬,[진가네반찬]곤드레나물볶음,,4700,구수한 향취를 그대로
911,밑반찬,[둥구나무자연그대로]시금치나물,,4300,가장 기본이 되는 나물 반찬
911,밑반찬,[진가네반찬]메추리알곤약장조림,,5900,짭짤한 장조림의 다채로운 매력
911,밑반찬,[Kurly's]고소하게구운도시락김12봉,10,3510,매일 갓 짜낸 들기름을 발라
911,밑반찬,[예찬원]착한치킨무,10,891,건강한 재료로 만든 알록달록 치킨무
911,밑반찬,[미자언니네]들깨건호박고지볶음,,4700,고소한 들깨를 더한 건호박 볶음
911,밑반찬,[미자언니네]영양만점꼴뚜기생땅콩조림,,6300,다채로운 식감을 즐기는 반찬
911,밑반찬,[두부씨의건강한끼]양배추김밥을위한숙쌈세트,,6800,돌돌 말아 즐기는 이색 양배추 쌈
911,밑반찬,[신사동백반]상큼한미니새송이곤약장아찌,,4200,쫄깃함을 담은 이색 장아찌
911,밑반찬,[씨뜰리에]표고버섯장아찌150g,,6900,해양심층수 머금은 쫄깃 장아찌
911,밑반찬,[씨뜰리에]초석잠장아찌150g,,6900,맛도 모양도 특별한 별미 반찬
911,밑반찬,[진가네반찬]양배추피망볶음,,4900,굴 소스로 볶아낸 별미 반찬
911,밑반찬,[진가네반찬]오이볶음,,4900,산뜻하게 입맛 살려 줄
911,밑반찬,[둥구나무자연그대로]부지깽이나물,,4300,은은한 향을 즐기는 나물 반찬
911,밑반찬,[올음]오이피클,,2700,아삭한 오이가 입은 새콤함
911,밑반찬,[스마일찬]마늘쫑소고기간장조림,,3900,달짝지근하게 입맛 돋우는
911,밑반찬,[도리깨침]건곤드레나물,,4600,소박한 모양에 담긴 구수한 맛
911,밑반찬,[도리깨침]시래기나물,,4600,시래기 본연의 정겨운 향취가 깃든
911,밑반찬,[도리깨침]건취나물,,4600,고소함을 입은 싱그러운 취나물 반찬
911,밑반찬,[도리깨침]건호박나물,,4600,
911,밑반찬,[도리깨침]건부지갱이나물,,4600,고소한 맛과 부드러운 식감
911,밑반찬,[신사동백반]건새우볶음,,4200,건새우와 마늘종의 하모니
911,밑반찬,[도리깨침]무나물,,4600,달콤한 무나물에 들깨가루를 솔솔
911,밑반찬,[진가네반찬]밥비벼먹는볶음김치,,5500,반찬 걱정을 덜어주는 만능 반찬
911,밑반찬,[신사동백반]도라지나물볶음,,4200,간편하게 즐기는 향긋한 도라지
911,밑반찬,[신사동백반]고추장소고기볶음,,3700,밥에 쓱쓱 비벼먹기 좋은
911,밑반찬,[빚고담고]쪽파장아찌,10,4860,입안 가득 퍼지는 쪽파의 향긋함
911,밑반찬,[진가네반찬]단무지양념무침,,5200,아삭아삭하게 씹히는 새콤 반찬
911,밑반찬,[씨투게더]다시마장아찌,,5900,새콤하게 즐기는 다시마의 감칠맛
911,밑반찬,[진가네반찬]다시마채액젓무침,,5200,액젓으로 더한 깊은 감칠맛
